3455190,Im type 2 diabetic and need to know natural ways to bring down hi sugar levels? ,[],[],[],0,0.63809526,0.332946092
3401927,How to manage Indian diet & insulin requirement for type1 diabetics to regulate HBAC between6&7? ,[],[],[],0,0.659286737,0.399321497
1027910,is sugar causes impotency? i am 30 years old an unmarried boy.i am afraid that i have sugar problem.,[],[],[],0,0.61336118,0.129375786
1072682,What will happen if a person take 30 tablets of restyle 0.5 mg? ,[],[],[],0.025192784,0.613871515,0.254851878
2149023,is juvenile diabetes the same thing as type 1 diabetes? ,[],[],[],0.154069251,0.665692568,0.270208716
347646,Help asap i am really dizzy? ok i am 10 and really dizzy all of a sudden HELP,[],[],[],0,0.594415844,0.05240716
1654617,blood sugar......................................? is 56 in blood sugar before breakfast too low  or its normal low?,[],[],[],0,0.52586031,0.239765376
41866,If someone who has Pre-Diabetes(and taking care of it) later on will they eventually get type 2 Diabetes? ,[],[],[],0,0.589656413,0.255625248
171828,"what difficult,complex or sensitive issue were u work on with this indvidual? in nvq 3 in care",[],[],[],0,0.625117064,0.298080385
226968,my blood p is 90/60 now what will is a safe bp wile asleep?? it will drop even more...? ,[],[],[],0,0.595160961,0.106967792
2468966,What are the best vegetables for type 1 diabetics ? ,[],[],[],0.042652312,0.625901818,0.25419724
2994607,I have given insulin at 90 degree on deltoid region so any complications? ,[],[],[],0,0.59751606,0.264325619
2758401,my blood preasure is 158 over 83 is that nromal? ,[],[],[],0,0.568175912,0.236420199
275745,what is this medication used for? what is ciprofloxacin HCL 500mg used for?,[],[],[],0,0.601265013,0.134152055
254325,"Can type 1 diabetics work in  the military? Or anyother government service like the FBI,CIA, or police force?",[],[],[],0,0.652250767,0.334370136
3704019,Took 12 pieces of Exlax? I took 12 pieces all at once. Call poison control or go to hospital?,[],[],[],0,0.563615799,0.19767049
3516040,I ate at 1:30 PM and my blood and urine test 6:30 PM. The result can be rite? ,[],[],[],0,0.532727778,0.250445366
1806590,sugar level 176 after 2hr after eating? ,[],[],[],0,0.484733731,0.321195364
313802,Should doing xtc for 3 months give you hair loss? ,[],[],[],0,0.503588557,0.112108812
1971399,I have to go a hospital if my sugar level is 253? ,[],[],[],0,0.545653582,0.388190001
1556409,Is ad toner safe for a type 1 Diabetic? ,[],[],[],0,0.521628678,0.177688927
860741,Why is type 2 diabetes called  adult onset diabetes? ,[],[],[],0,0.596957624,0.286802262
575813,what would happen if someone drank orange juice that was 3 weeks expired? ,[],[],[],0,0.606677651,0.086069599
1499929,Am I underweight??????????????????????????????????????????????????????????????????????????????????????????? I sm 30 and weigh 64 pounds.  People say I am.  Am I?,[],[],[],0,0.504923821,0.414352834
1566878,How does Marijuana affect type 1 diabetes? ,[],[],[],0,0.639828384,0.150771484
308588,"do they ask about diabetes in an eng 1 medical exam? for eg type 1, 2 or low/high blood sugar",[],[],[],0,0.584117115,0.212176263
3671982,Does Tylenol raise blood sugar in people with type 2 diabetes? ,[],[],[],0,0.620309591,0.249348104
3478412,If you suffer from type 1 diabetes can you learn to drive at the age of 16? ,[],[],[],0,0.555362225,0.111132413
308593,"What is suggested for glucose levels, taking glyburide 10mg. 2x day & 5 units of Lantus 1x a day? ",[],[],[],0.019047699,0.696781278,0.404168546
308634,3.)What are the dangers and/or advantages of using insulin shock therapy in treatment of  schizophrenia? ,[],[],[],0,0.552835226,0.070798278
334553,where can i buy Ace Bandages? does anybody know what store sells ace bandages that are 35 inches??,[],[],[],0,0.488475978,0.196606651
592776,BP is 80/35 is that OK? ,[],[],[],0,0.24298285,0.120237269
3251282,the sweetest of ALL sugars? 9 letter word? ,[],[],[],0,0.515993953,0.366869241
2686032,what if blood sugar test is 58? my age 60 weight 164 race - aa,[],[],[],0,0.470505655,0.276889622
2685200,"If f(x) = x, find f(137)? Since the derivative of f(x) is 1, would f(137) essentially be 1 also?",[],[],[],0,0.549167872,0.137091249
174468,i have been drinking vodka every day for almost 2 years every day im 39 what are the affecrs? ,[],[],[],0,0.552251816,0.179605395
151015,i didnt eat all day but my sugar level is 8.3mmol/l-150mg/dl is this high or worrying.? ,[],[],[],0,0.584804177,0.315962344
829614,Potassium level was 0.6? With potassium level that low how long is it survivable?,[],[],[],0,0.613089263,0.309610277
2758831,what if any is the diffrence between novofine 30G pin needles and novofine 32G tip needles used for insulin? ,[],[],[],0,0.612435699,0.23432374
1824438,has a person who has been diagnosed with type 2 diabetes now got this condition for life? ,[],[],[],0,0.65127331,0.37560457
684960,I have a cholesteral level 200 in spain can someone tell me what this would be in England? ,[],[],[],0,0.615980625,0.121349096
440917,"what are the requirements for someone with type 2 diabetes ? like food, nutrition, sugar requirements",[],[],[],0,0.601397753,0.299798191
3598002,What factors increases the risk of diabetes 2? ,[],[],[],0.038482759,0.608210564,0.200652227
76370,"What is the usual life expectancy of someone on dialysis, diabetes, and is 63yrs old.? ",[],[],[],0.025253994,0.60970664,0.231184989
1206724,is 160 blood surgar count high? Im 53 yr. old man with blood sugar level 160,[],[],[],0,0.605912924,0.297963858
96596,Whats a good exercise regimen for someone w/ Type 2 Diabetes? ,[],[],[],0.032168105,0.684903204,0.359846592
3215540,Type 2 diabetes symptoms? could pain in the hands and feet be a symptom??,[],[],[],0,0.562520206,0.189040139
3802623,which one of these blood glucose monitors does not require strips or losing blood? These are the links.http://www.cvs.com/shop/Home-Health-Care/Diabetes-Care/Diabetes-Monitors/_/N-3uZ13meg4Z2k?pt=SUBCATEGORY,[],[],[],0,0.651828289,0.113373742
1994309,i am 5ft 8 and 9 and a half stone am i overweight? ,[],[],[],0,0.356927395,0.362066507
1812549,Diabetes question: That white plastic thing that goes on your arm? http://www.facebook.com/media/set/?set=a.1184301704509.22099.1737261760What is that and what does it do?,[],[],[],0.080860536,0.666244447,0.079096034
3626044,What causes teary eyes in Type 2 diabetics? ,[],[],[],0.034656858,0.661759377,0.260377854
3731202,my sugar is 59 and how can i make it go to 80-120? ,[],[],[],0,0.51305157,0.303133756
1165593,What is the best insulin pump on the U.K market in 2011? ,[],[],[],0.025707434,0.52127111,0.213224575
3215812,can some tell me what my urine indicate I have a Dr. appointment in about a week? Glu-negativeBil-NegativeSg-1.02Blo-tracePh-6.5Pro-NegativeUro-0.2 e.u/dlNit-NegativeLeu-Small,[],[],[],0,0.587357283,0.279726744
563236,how bad is 365 blood sugar? i tested about 1:30  hours after i had a chunck of cake.,[],[],[],0,0.524966598,0.18675372
3079506,What is 0.5ml in units? ,[],[],[],0.039239986,0.584089994,0.524792194
3031391,Is 120 over 88 and pulse 105 okay? ,[],[],[],0,0.408860922,0.358600438
2555284,What happens when your blood sugar is at 480? ,[],[],[],0.040695635,0.649293065,0.285563201
592807,What happnes if you dont take insulin with diabetes type 1? ,[],[],[],0.034560664,0.671422362,0.301351726
28891,Just diagnosed with Type 2 Diabetes. How much sugar can one have in a day? Or on a food label? ,[],[],[],0,0.629596949,0.322438598
1494896,Is there a cure for type 1 diabetes? Is there any cure yet? Or tests?,[],[],[],0,0.504889607,0.169265822
802994,Which are 3 the best books of diabetes causes? ,[],[],[],0,0.488973886,0.121211991
3563527,My blood sugar is 591? Im type two diabetes,[],[],[],0,0.583565235,0.28524369
115020,what is a INITIAL  MEDICATION RECONCILIATION FORM.SUM 1 ANSWERS QUICK.LIKE IN 5MINS PLZZZ? ,[],[],[],0,0.559724987,0.408977985
3614957,What is a easy healthy weight loss meal plan for diabetics w/ type 1? ,[],[],[],0.02720345,0.66547662,0.323947907
3755237,Is a Gamma GT reading of 109 cause for concern? ,[],[],[],0,0.542141914,0.155667886
610816,My B12 level was 300 and my endocrinologist put me on B12 shots im also type 1 diabetic and hypothyroidism? ,[],[],[],0,0.603560746,0.208353192
2518141,Where to go in a major life ending event with type 1 diabetes ? Serious answers only,[],[],[],0,0.572869539,0.186584413
3358599,What is type 1 diabetes? ,[],[],[],0.09304893,0.617665231,0.362642169
3563554,How does diet help prevent type 2 diabetes? ,[],[],[],0,0.586588144,0.314833731
1047720,How to draw 6 units of insulin on a 1ml syringe? ,[],[],[],0,0.605739474,0.26868391
1775048,Mood swings with type 1 diabeties? ,[],[],[],0,0.565676212,0.128637984
3563555,what is the ICD-9 code for diabetes mellitus with iritis? ,[],[],[],0,0.478094846,0.269352913
1330325,"Type 2 Diabetic, bedtime numbers? What is a good range to be in before bedtime?",[],[],[],0.023616464,0.649012804,0.387603283
3780126,My dad is 60years old and blood sugar patient and has joint pain. Can He take REVITAL daily? ,[],[],[],0,0.554729581,0.179088771
273155,Can glipizide/metformin cause cancer? Type 2 diabetes drug glipizide/metformin cause cancer?,[],[],[],0,0.611836255,0.226657927
1139716,"I took a percaset at 5pm, if I drink at around 10pm will there still be bad side effects? ",[],[],[],0,0.527456045,0.125042677
2555394,Is generic Tegretol XR 200 mg available in the USA? and as a tablet not a capsule?,[],[],[],0,0.588470876,0.210285291
625725,Is Soy milk better for diabetes? Type 2 diabetes btw.,[],[],[],0,0.545045376,0.214815944
3127154,is a 500 calorie diet good for diabetic??? if not what is ? ,[],[],[],0,0.553556502,0.396047652
3439997,What is the a1c for 533? Type 1 diabetic,[],[],[],0.039081603,0.650712729,0.411113918
2919408,do you think type 1 diabetics rely too much on insulin pump technology? big paper due in 2 days.,[],[],[],0,0.635069668,0.199973643
153759,IS TYPE 1 WORSER THAN TYPE 2 DIABETES? ,[],[],[],0,0.571377933,0.322285116
3462214,biguanides and diabetes? what is biguanides used for type 1 diabetes or 2?  What are the disadvantages and advantages?,[],[],[],0.020380318,0.677834868,0.273050636
3401760,"How long untill you can go home after haveing your thyroid out? For some aged 14year, and is it painfull?",[],[],[],0,0.59855181,0.192011237
3610177,Ketone bodies appear in the urine due to diabetes mellitus during? 1. Ketosis2. albuminuria3. Creatinuria4. Myoglobinuriaplease selct the correct answer,[],[],[],0,0.692326546,0.272561371
1186155,"3 year old daughter with blood,glucose and protein in urine. Is this normal? ",[],[],[],0,0.58163935,0.078197405
114990,My husband has never been diagnosed with diabetes but has all symptoms and blood sugar was 464 today? Any idea? ,[],[],[],0,0.590500593,0.161844403
3740950,my tsh is .117 should I be concerned? I am taking .88 synthroid,[],[],[],0,0.569144785,0.241163299
531016,HOW HIGH SHOULD A NONDIABETICS BLOOD SUGAR GET AFTER 1 HOUR OF EATING ...PIECE OF PIZZA AND BIRHTDAY CAKE? ,[],[],[],0,0.566538096,0.270263195
1816189,what sugar level is normal for a cat? my cats sugar is at 380...,[],[],[],0,0.527388871,0.142130822
3126887,my insulin is 18.9 its high or low ?please help i m confused? ,[],[],[],0,0.592304528,0.336605012
3290347,How many times can the honeymoon phase occur in type 1 diabetes? ,[],[],[],0,0.677898049,0.067401797
1085172,my 3 year olds fasting sugar was 328 is that normal? ,[],[],[],0,0.46929273,0.122078359
3778517,Im a type 1 diabetic and I keep cramping up everyone I play basketball what should I do ??? ,[],[],[],0,0.553106308,0.170382083
918283,"Can people die from Type 1 Diabetes? If so, how? Like how does the diabetes cause a death?",[],[],[],0,0.630462349,0.176702216
734113,What are 5 signs and symptoms of muscle fatigue? ,[],[],[],0.031194896,0.675061107,0.272895396
1372877,what % off people with diabetes are fat? And also are you fat thin or got type 1 just wonderin,[],[],[],0,0.621957839,0.362532497
844105,after about 4 hours after eating my blood sugar was 160? is that normal?,[],[],[],0,0.558875322,0.160995722
3031599,"i have peed at least 20 times today, do i have a chance of having diabetes? ",[],[],[],0,0.50535965,0.13067013
1219282,Any one have fasting testimonies? Im starting a water fast today and i need motivation... im 232 lbs??,[],[],[],0,0.561116934,0.424724788
3172067,Why is weightlifting good for preventing or managing type 2 Diabetes? ,[],[],[],0,0.627570748,0.357115537
937037,Is there a diagnosis for low blood sugars? my blood sugar is 2.5 at the minute. How bad is that?,[],[],[],0,0.586033404,0.202798098
1331179,What are the best foods a diabetic 50 yr. old should eat? ,[],[],[],0.033220591,0.5618819,0.193625271
3685092,My rbc count is 4.3. Am I suffering from anaemia? Normal range is 4.5-5.5,[],[],[],0,0.559944987,0.257056296
1994018,If your 16 and weight 150 can you get diabetes? Height 50,[],[],[],0,0.494547606,0.325373381
1814471,I am not a diabetics.If I will take 20 dionil tablets what is the reaction to me? ,[],[],[],0,0.547246337,0.126531512
3171938,How to bring a 102.3 tempeture down? ,[],[],[],0,0.496075928,0.13786307
28964,Is type 1 diabetes Hyperglycemia or Hypoglycemia? ,[],[],[],0,0.51202333,0.287350237
3516124,Do you think there will be a diabetes type 1 cure? ,[],[],[],0,0.578182221,0.108038195
1837989,I want a sugar mumy of the age 25 and below? 0750718455,[],[],[],0,0.480841994,0.197313666
747271,i check my sugar level in one touch it read 339? ,[],[],[],0,0.501822949,0.270251155
3031538,Can you get diabetes from Rice krispie treats? i eat about 7 mini treats a day.,[],[],[],0,0.492863417,0.225809127
2076723,can stem cell transplant treat Diabetes? http://www.diabetes-kidney.org/type-1-diabetes/292.html,[],[],[],0,0.510229349,0.054638535
2758642,How many cc of insulin are in 300iu? ,[],[],[],0,0.648476839,0.181434736
3766551,rash between my legs after having sex with my type 2 diabetes husband? ,[],[],[],0,0.550074935,0.141890347
1966595,im thinking about gaining 300 pounds give or take 350 pounds thoughts? ,[],[],[],0,0.516123653,0.356835246
1682514,What is the weight of a Shetland 535? With 75hp outboard,[],[],[],0.022541511,0.483262599,0.311508805
1631585,should i take ZANTAC 150 MG IN THE MORNING OR AT NIGHT? ,[],[],[],0,0.432608128,0.128857911
665704,Can boozing too much bring on type 2 diabetes over time? Or does that have nothing to do with it? ,[],[],[],0,0.572191238,0.244392887
1994285,"My hb level is 8 I m very weak, how can I increase the level to 11 or 12? ",[],[],[],0,0.510701418,0.253241867
2206353,prandin 1 mg 2 mg 0.5 mg? Where can I buy cheap prandin,[],[],[],0,0.565461397,0.162351534
80054,"On an animas 2020 insulin pump, how do you slow down the insulin delivery? ",[],[],[],0,0.553240478,0.261757851
303417,net Carbs? as a diabetic can i eat food that has 18 carbs but 3 NET carbs?? ,[],[],[],0,0.528393149,0.254590303
83383,the reading of sugar (98-110) is normal? ,[],[],[],0,0.451951623,0.23723647
2164856,Is 104 over 56 a good blood presure for a 31 year old woman with two kids? ,[],[],[],0,0.54789263,0.184710115
65496,my dads sugar is over 400.how high is that? ,[],[],[],0,0.446460128,0.267469138
663333,how much sugar in a 12oz can of beer? how many grams of sugar in a 12oz can of beer,[],[],[],0,0.494861841,0.169769377
652885,high blood surgar levels symptoms over 500? In a 1 year old.  What can happen if not treated promply?,[],[],[],0.022223246,0.679863453,0.167278349
33360,diabetic meal plan for person weighing 230 lbs and 59 years old? ,[],[],[],0,0.519398451,0.325436354
2518155,what is a non dibetic level for a 23 year old? ,[],[],[],0,0.425652266,0.162020981
2351462,103 at 18.... Underweight? ? I will be 18 in April and weigh 103 pounds. I am 51,[],[],[],0,0.47993809,0.362533152
142879,"Im endocrinologist,like to have a clinical attachment in reproductive endocrinology for 6 months in UK,HOW? ",[],[],[],0,0.631280005,0.160609216
2393414,Who diagnostic criteria for diabetes 2011? ,[],[],[],0,0.512591004,0.327328235
1684901,What is the difference between type 1 and 2 diabetes? ,[],[],[],0.060775464,0.61796689,0.354709238
1165583,"Whats the difference between type 1, type 2, and type 3 Diabetes? ",[],[],[],0.039598973,0.613139749,0.313444078
37620,I am a type 1 diabetic. What is the chance I will pass diabetes to my kids? ,[],[],[],0.033055877,0.63815546,0.326358765
3290537,Is 287 high for an amounia level in blood test? ,[],[],[],0,0.473614931,0.243189156
3358693,how to strengthen liver for 67 years old diabetic type 11 insulin patient? ,[],[],[],0,0.554488421,0.237765059
3671454,My blood suger i checked after breakfast is 180. i m 25 yrs old. do i have diabetes.? ,[],[],[],0,0.538047254,0.187721521
375781,Is there a website to interview a person about type 2 diabetes? I need this for a project,[],[],[],0,0.522152543,0.312427193
1085136,blood Sugar of 55 still take insulin needle or no? ,[],[],[],0,0.608352065,0.270736665
2758759,My father is 80 years old. Diabetic. His haemoglobin count is 9 only. How to build up haemoglobin.? ,[],[],[],0,0.647030652,0.217711911
3031552,0.9 creatine level is that normal for kidney function? ,[],[],[],0,0.609178543,0.264733195
3780171,Can I get diabetes at 12 and 90 pounds Im just a little freaked out? ,[],[],[],0,0.582493186,0.344191313
2294734,Whats a website that I can buy 1ft 2in black real human hair extension with the clips already on them? ,[],[],[],0.016970889,0.551513612,0.136436671
1708955,I am not a diabetic but my sugar is 243 what do I do? ,[],[],[],0,0.515067101,0.348151505
420307,ER 5 On OneTouch Meter? My OneTouch Meter keeps showing ER5 on the screen. Does anyone know what this means?,[],[],[],0.033375487,0.571664095,0.278381556
2994610,is my blood pressure ok when standing the reading is 91 over 58? ,[],[],[],0,0.599696994,0.301543862
1248030,type 2 diabetes what will happen to your body over the long run if diabetes is left unchecked? ,[],[],[],0,0.655769587,0.185156971
1659510,Can I have an extra dose of insulin NOVO-MIX 30 before an unexpected meal? ,[],[],[],0,0.599151969,0.231778443
1173447,"postprandial blood glucose level 166 milligrams is normal or not? if NO, then what is normal level?",[],[],[],0,0.642349005,0.226699337
976871,If someone is healthy but constantly experiencing hot body temperature since teenage til now that he is 28yrs ? ,[],[],[],0,0.618421733,0.205776498
665715,my girlfriend is pregnant and is a type 2 diabetic and wants an abortion is this good? ,[],[],[],0,0.53621161,0.047692634
2685640,167 and over 90 diabetic on norvacs and lisinipril is my bp to high? ,[],[],[],0,0.56214875,0.230308265
1801858,For someone with type 2 diabetes is eating chili okay? ,[],[],[],0,0.645123422,0.18203333
283259,Type 1 Diabetics- how old were you when diagnosed and what symptoms were you exhibiting? ,[],[],[],0,0.588327169,0.123693779
610804,what does type 1 diabetics have to take tell me specifically.? ,[],[],[],0,0.6103369,0.304871112
305942,I am 52  years old Blood sugar after food 11/2 hrs is 92 mg /dl. is it ok? ,[],[],[],0,0.561683178,0.244872689
615436,Is peanut butter good for diabetes 2 person to have ? ,[],[],[],0,0.507717848,0.284665108
3386172,Am I underweight please answer?!? Im 54 or 55 and 106 pounds... Am I underweight Im 14,[],[],[],0,0.466232389,0.318511635
15223,How much sugar is in skim milk?I have type 2 diabetes and like milk with one meal? ,[],[],[],0,0.620079458,0.364160657
1692058,"If insulin is unrefrigerated ove 10, can it be use? ",[],[],[],0,0.596648157,0.268197894
1586162,It seems like I might be at risk for Type 2 Diabetes. For what symptoms should I look out? ,[],[],[],0,0.571154594,0.182912841
3780233,Should I take lisinopril in the am if usually take at night with bp158/98? ,[],[],[],0,0.56131959,0.11832422
443347,What is the average age of a person when he or she get Type 2 diabetes? ,[],[],[],0.037515056,0.651664972,0.397050798
1493913,how to becom slim in 1 month? i want a good answer plzzzzzzzzzzzzzzz.................,[],[],[],0,0.569333971,0.297318578
3455202,my triglyceride level is 1400 what di i do to lower it? ,[],[],[],0,0.552204847,0.201730281
3684893,my TSH level is 12.5 and i taking 25 mcg thyronorm it write for me? ,[],[],[],0,0.625879884,0.354340851
2685537,Is 61 normal blood sugar for a two year old? ,[],[],[],0,0.516325951,0.206143946
3779980,i was told i have sugar in my urine but tested blood sugar it was 123? ,[],[],[],0,0.543252826,0.222699374
986334,lipitor or vytorin which one is good for type 2 diabetics? ,[],[],[],0,0.647378743,0.365513742
899378,"Does Calorad MG work? If you have tried it, does the 3 month Calorad MG plan work?",[],[],[],0,0.542124987,0.183742657
1994505,how much sugar is reduced by 2 units of insulin? ,[],[],[],0,0.569094479,0.333465785
3478180,MY MCHC IS 35.8 g/dL is it alarming? my MCV BLOOD TEST IS 87 AND MCH IS 31pg,[],[],[],0,0.533268213,0.254867613
164054,wat is cause o f death of srinivasa naidu?1021? ,[],[],[],0,0.557594776,0.400234222
3462327,What food should I avoid? I have Type 2 diabetes and struggling to get the blood sugar levels down.,[],[],[],0.031344798,0.642402172,0.31554693
1201494,Does staphyllococus aureus affect ones fertility and 2 what extent? ,[],[],[],0,0.658130288,0.175104693
1067715,Potato bread has less carbs then wheat bread so is it ok for a type 1 diabetic to eat? ,[],[],[],0,0.548076034,0.244306803
420336,for how long kestine 10 mg tablets once daily can be used? ,[],[],[],0,0.533686042,0.184714645
1540930,Can severe Stage 2 diabetes lead to Alzheimers disease? Sorry  Type 2 Diabetes :) Sorry ,[],[],[],0,0.608966827,0.295811713
2069124,I have a blood test on monday Oct. 31 checking for cholsterol and i recently smoke. The thc show up? ,[],[],[],0,0.614897609,0.104520552
177103,can i trip or get high off of lisinopril? 10 mg,[],[],[],0,0.544614077,0.174605817
57968,can anybody please help me and tell what kind of food is forbidden when using isosupra 16 mg? ,[],[],[],0,0.627409101,0.272610724
267892,where can I find diabetic shoes  in the md/dc area? New Balance 811,[],[],[],0,0.536724389,0.135644123
1822733,how much weight can you lose water fasting for 4 days ? ,[],[],[],0,0.509679139,0.296345115
619395,how much insulin should be taken if blood sugar 192 after dinner? ,[],[],[],0,0.561568916,0.226773053
166626,why is insulin not always used wiyh type 2 diabetes? ,[],[],[],0,0.680564642,0.296976119
1131741,how much potassium is in 1 banana? ,[],[],[],0,0.575996161,0.276346535
108916,My blood uric acid level is 6.8 mg/dl .is it serious? ,[],[],[],0,0.5525558,0.23546651
894520,Is it possible to get diabetic neuropathy at age 30? ,[],[],[],0,0.538003445,0.25033617
142863,can type 1 diabetics have kids? ,[],[],[],0,0.559474945,0.251833886
1198931,how bad is 28 blood sugar? ,[],[],[],0,0.495504797,0.209994972
889747,Are you aware about diabetes type 1? Do you know everything you can about diabetes? reply with what you know.,[],[],[],0,0.656845689,0.351686329
2758838,Is sugar levels consistently over 200 with insulin dangerous ? ,[],[],[],0.208456441,0.551445603,0.325839877
988730,how to increase 5 kgs in one month? ,[],[],[],0,0.49786222,0.426264525
2555503,"i have been operated 4 stone in kidney,plz tell me d precautions? ",[],[],[],0,0.525229693,0.429888189
1087651,"if you are a diabetic would u try this recipe? http://www.cooks.com/rec/view/0,2314,155179-233201,00.html",[],[],[],0,0.554664552,0.255124211
1863498,1170 mg = how many grams ? ,[],[],[],0,0.544615567,0.22161822
54111,whats the difference between type 1 diabetes and type 2? just wondering,[],[],[],0.039811492,0.660325766,0.268271387
80083,What foods should a 78 yr old male w/ diabetes avoid? ,[],[],[],0.029863762,0.602215231,0.145916134
2685502,Type 1 diabetes info? How much sugar should a type one diabetic have,[],[],[],0,0.648482204,0.290290415
3215594,My level hcg level is 104 is that good? ,[],[],[],0,0.471241713,0.248316333
3530495,I have diabetes and take 2 insulin with high blood pressure. do i qualify for disability.? ,[],[],[],0,0.569238782,0.324013233
2076680,Blood sugar of 131 is that a good number? Just got these results today.,[],[],[],0,0.582793534,0.225733385
625723,what is type 2 diabetis? ,[],[],[],0,0.548028886,0.316109568
3685050,"Need to know if Im overweight? Im 15, 55 and 140 pounds",[],[],[],0,0.484663665,0.392847419
61660,Blood sugar at 196 after eating a little candy.. is this normal? ,[],[],[],0,0.628060877,0.232378036
700753,does being a diabetic type 1 prevents you from getting a pco licence? ,[],[],[],0,0.67385304,0.168349937
3518645,"My partner has type 1 diabetes, what can I do to help and make his life a little easier? ",[],[],[],0,0.575760543,0.132303223
1832467,can a diabetic with type 2 and have thyrid take zantex 3? ,[],[],[],0,0.62049973,0.242342278
3455070,Type 2 Diabetes Metformin? How metformin helps cure it? Please be specific in a cellular level. Thanks!,[],[],[],0,0.688932598,0.262472808
3358164,"My mother having kidney problem and according to reports her UREA =80.9 and CREATINE =2.1, please suggest me!!? ",[],[],[],0,0.653227568,0.168704882
57818,Where can I find the latest  diabetes research? *THIS IS  FOR TYPE 1*? easy 10 points :),[],[],[],0,0.630763948,0.229627222
2476850,My blood pressure is 110 over 61 is that bad? ,[],[],[],0,0.546754539,0.287250191
630715,Im a type 1 diabetic without health insurance. What do I do? ,[],[],[],0.034881922,0.575091362,0.27726537
473281,can people with diabetes drink alcoholic beverages? with diabetes type 2.,[],[],[],0,0.575403094,0.242980868
846524,how old do i have to be to take wheybolic extreme 60? it is a protein supplement,[],[],[],0,0.594501138,0.299609006
