206995,What does this creatinine thing mean? Creatinine 5.7 - Consistent with kidntey failure?,[],[],"['Creatinine', '=', '5.7']",1,1.000000238,1.000000119
2247438,why plasma glucose is 10 to 15% higher than corresponding whole blood glucose concentration? ,"['plasma_glucose_result,', '>=', '10,', '%,', 'plasma_glucose_result,', '<=', '15,', '%']",[],[],0,0.642488718,0.155423597
2881748,i have not eaten in 2 days and my blood sugar levels are 159? are these levels high,"['blood_glucose_measurement,', '=', '2,', 'days,', 'blood_glucose_measurement,', '=', '159,']",[],[],0,0.53642565,0.246967673
3663888,is an A1c level of 8.0 bad? ,[],"['HBA1C,', '=', '8.0,']",[],0,0.495109588,0.32290557
3808799,I have nill glucose in urine test but my HbA1C is 10?/ How come? ,[],"['HBA1C,', '=', '10.0,']",[],0,0.66428256,0.226218402
83397,"My glucose is 120, tryglycerides 95, LDL 128, HDL 53, carbon dioxide 32, what does this mean? ","['Glucose,', '=', '120,', ',', 'Glucose,', '=', '95,', ',', 'Glucose,', '=', '128,', ',', 'Glucose,', '=', '53,', ',', 'Glucose,', '=', '32,']",[],[],0.03846504,0.604626119,0.25227505
3079780,"Albumin/Creatinine ratio? Is an Albumin/Creatinine ratio of 0.7 normal? Im female, 29.",[],[],"['Creatinine_ratio', '=', '0.7']",0,0.609897494,0.35635668
490298,"What is Serum Chemistry. My Serum Creatinine shows 1.50MG/DL, what that means & what precaution should be take? ",[],[],"['Creatinine', '=', '1.50', 'mg/dl']",0.217451695,0.790485203,0.284438551
1891547,i just had 3 cup water and did my blood sugar level it was 5.3 is this normal for non-diabetic? ,"['blood_glucose_measurement,', '=', '3,', ',', 'blood_glucose_measurement,', '=', '5.3,']",[],[],0,0.516337872,0.277835846
670465,"I had a starbucks an hr before a bloodtest, and my glucose was 230. Should i be worried? ","['Glucose,', '=', '230,']",[],[],0,0.578386545,0.190217614
863102,Should I celebrate my 6.6 A1c with a cream filled donut or a banana split? ,[],"['HBA1C,', '=', '6.6,']",[],0,0.497549862,0.309720516
1065217,108 glucose too high for your sugar level? ,"['Glucose,', '=', '108,']",[],[],0,0.560633898,0.357779026
2367457,My Nan has a blood sugar level of 2 I know this is bad (but how bad?)? thanks,"['blood_glucose_measurement,', '=', '2,']",[],[],0,0.619566917,0.331165761
1330863,I am female. Age 55years. My S creatinine 5.1 what can I do? ,[],[],"['Creatinine', '=', '5.1']",0.217975155,0.58510828,0.282334387
1856600,Fasting blood sugar is 130. am i diabetic? Im 30 years old female,"['Glucose,', '=', '130,']",[],[],0,0.569102287,0.231097922
590290,My blood sugar level is 112. Is it already a must for me to take/maintain 500-1000mg of Metformin everyday? ,"['blood_glucose_measurement,', '=', '112,']",[],[],0,0.593354344,0.285433561
2555099,fasting blood sugar question? if someone has a fasting blood sugar of 5.7( 105) is that highh??,"['Glucose,', '=', '5.7,']",[],[],0.137262335,0.589309573,0.337394297
3779970,"my 5 year old child fasting blood sugar is 110mg/dl ,How it is normal or she want to medicine,? ","['Glucose,', '=', '5,', 'year,', 'Glucose,', '=', '110,', 'mg/dl']",[],[],0,0.615764976,0.174360067
713903,Is a 6.0 A1C average over a 10 year period very good control? ,[],"['HBA1C,', '=', '6.0,']",[],0,0.519668222,0.354858756
3478300,is a 53.0 mg CREATININE level normal for a woman? ,[],[],"['Creatinine', '=', '53.0', 'mg']",0.240960199,0.632383943,0.32517767
1206724,is 160 blood surgar count high? Im 53 yr. old man with blood sugar level 160,"['blood_glucose_measurement,', '=', '160,']",[],[],0,0.605912924,0.297963858
790946,LOST 8-9-10 POUNDS...NOT DIABETIC BUT A1C WAS 6.1 IN JULY...WILL LOSING SOME WEIGHT HELP MY NEXT TESTING? ,[],"['HBA1C,', '=', '6.1,']",[],0,0.596217156,0.383653104
216699,after full food 2 hours later my random blood sugar level is 97.4 whether i am diabetic or not ? ,"['blood_glucose_measurement,', '=', '2,', 'hours,', 'blood_glucose_measurement,', '=', '97.4,']",[],[],0,0.550053179,0.215001136
2882318,how do you interpret a Fasting Plasma Glucose level of 6.2 mmol/l ? ,"['plasma_glucose_result,', '=', '6.2,', 'mmol/l']",[],[],0,0.614256561,0.297960997
951471,what is 8 year child sugar level? normal blood sugar level of 8years old Child after food  and before food,"['blood_glucose_measurement,', '=', '8,', 'years']",[],[],0,0.517197073,0.173358217
1830847,Is 4.2 a good A1C level? ,[],"['HBA1C,', '=', '4.2,']",[],0,0.428655714,0.410569489
430242,my 13 year olds blood sugar Level first thing in the morning before eating was 120 is this ok? ,"['blood_glucose_measurement,', '=', '13,', 'year,', 'blood_glucose_measurement,', '=', '120,']",[],[],0.093669376,0.609315872,0.210636109
3401766,Can a 32yr male experience low blood glucose sugar without having diabetes? ,"['Glucose,', '=', '32,']",[],[],0,0.61434263,0.201438338
2420503,is 398 a dangerous blood sugar level? ,"['blood_glucose_measurement,', '=', '398,']",[],[],0,0.487844139,0.257882893
150986,im m/28.i tested my blood sugar level after 20 min of supper.my blood sugar level shows 120.is this normal? ,"['blood_glucose_measurement,', '=', '28,', ',', 'blood_glucose_measurement,', '=', '20,', ',', 'blood_glucose_measurement,', '=', '120,']",[],[],0,0.59244287,0.23495613
2555305,Whats a healthy blood glucose in a 28yr old male 6\7 195lbs? Family history of diabetics .,"['Glucose,', '=', '28,']",[],[],0.021438712,0.570322156,0.395361722
3545649,Is 6.1 a good A1c level? Almost forgot I am a T1D.,[],"['HBA1C,', '=', '6.1,']",[],0,0.511466146,0.426525295
836896,is 80 a normal glucose reading? ,"['Glucose,', '=', '80,']",[],[],0,0.563212693,0.152668744
3779947,"Now that my diabetes is treated and my blood glucose is 100, will my urine glucose go to zero? ","['Glucose,', '=', '100,']",[],[],0,0.662098408,0.184563205
1606266,hba1c 6.5 does this indicate im diabetic? never had test before,[],"['HBA1C,', '=', '6.5,']",[],0,0.602175236,0.398854077
54045,Having 3+(1.0g/dl) glucose in urin safe? Sugar in urin is more dangerous than the sugar in blood? Plz answer.? ,"['Glucose,', '=', '3,', ',', 'Glucose,', '=', '1.0,', 'g/dl']",[],[],0,0.63864398,0.21187067
592796,I checked my blood sugar levels today and it read 9.5. Is this normal? ,"['blood_glucose_measurement,', '=', '9.5,']",[],[],0,0.540335536,0.211789742
517278,my blood sugar level is 400 what shall i do to reduce it? ,"['blood_glucose_measurement,', '=', '400,']",[],[],0,0.579825938,0.309750497
1330832,what is a normal blood sugar level for a 7 year old boy.? ,"['blood_glucose_measurement,', '=', '7,', 'year']",[],[],0,0.566664219,0.189445764
1224620,my glucose fasting test is 107. Is it normal? ,"['Glucose,', '=', '107,']",[],[],0,0.595996857,0.208570495
114931,what is an average blood sugar if your a1c is 17? ,[],"['HBA1C,', '=', '17.0,']",[],0,0.539681315,0.230877847
93306,fasting glucose of 145 what does it mean? ,"['Glucose,', '=', '145,']",[],[],0.087565033,0.609336495,0.416468442
1994045,Had a fasting blood sugar test which gave 4.5. The doctor said this is ok. Can anyone give more explanation? ,"['Glucose,', '=', '4.5,']",[],[],0,0.600881338,0.185274005
2303014,Blood sugar level of 80? Is it normal for blood sugar to be 80 two hours after eating?,"['blood_glucose_measurement,', '=', '80,']",[],[],0,0.562455952,0.188403621
1201502,Is it normal to have 6.3 as my blood sugar level ? ,"['blood_glucose_measurement,', '=', '6.3,']",[],[],0,0.490719259,0.276416183
2685750,is 180 high for blood glucose? ,"['Glucose,', '=', '180,']",[],[],0,0.499769092,0.241795018
3386264,my serum creatinine level is 1.42 is it riski? i am alcoholic,[],[],"['serum_creatinine_level', '=', '1.42']",0.214003578,0.633736134,0.18718648
33342,My blood sugar level was just measured at 164 after a meal. Does that suggest diabetes / pre-diabetes? ,"['blood_glucose_measurement,', '=', '164,']",[],[],0,0.613537192,0.309620231
2685205,Can a sugar patient consume watermelon? The blood sugar level is 164 pre prandial.,"['blood_glucose_measurement,', '=', '164,']",[],[],0,0.612934113,0.249665707
1917603,my blood sugar level was 136 after meal. is it normal or im diabetic ? im very worried? ,"['blood_glucose_measurement,', '=', '136,']",[],[],0,0.613770843,0.272972405
568177,My Fasting blood sugar today read 359. How bad am I? ,"['Glucose,', '=', '359,']",[],[],0,0.566282749,0.258096606
129177,Is it normal to have a glucose reading of 59 after doing a two hour glucose tolerance test? ,"['Glucose,', '=', '59,', 'reading']",[],[],0,0.601167321,0.132248476
3764642,I have a non fasting blood glucose reading of 110. Do I have pre diabetes? ,"['Glucose,', '=', '110,', 'reading']",[],[],0,0.601323247,0.189192981
610699,After my 1 1/2 hour lunch my random blood sugar level was 273 mg/dl. Is it dangerous? ,"['blood_glucose_measurement,', '=', '1,', ',', 'blood_glucose_measurement,', '>=', '1,', 'hour,', 'blood_glucose_measurement,', '<=', '2,', 'hour,', 'blood_glucose_measurement,', '=', '273,', 'mg/dl']",[],[],0,0.565411568,0.199817777
2826261,Are you made 25% gliceren with glucose solution? ,"['Glucose,', '=', '25,', '%']",[],[],0,0.57218349,0.202069715
560891,My creatinine level was 2.37. I am a type one diabetic ... what should I do ? ,[],[],"['Creatinine', '=', '2.37']",0.266938622,0.64981252,0.336623192
450669,My Blood sugar A1c level is 7.6 is what i was trying to ask. it that too high? ,[],"['HBA1C,', '=', '7.6,']",[],0,0.594895423,0.276822686
1824451,is 3 a normal reading for blood sugar levels? ,"['blood_glucose_measurement,', '=', '3,']",[],[],0,0.520076215,0.214028388
1040216,What is a healthy glucose (mmol/L) range for a 15 year old girl? Both before meals and after meals.Thank you.,"['Glucose,', '=', '15,', 'year']",[],[],0.020637183,0.620109856,0.331396222
3440174,Is 92 mg/dl blood sugar normal? Im 20..and thats my fasting blood sugar,"['Glucose,', '=', '20,']",[],[],0,0.598263741,0.257790923
214172,What does it mean when your blood sugar level is 100 and you feel like it is low? ,"['blood_glucose_measurement,', '=', '100,']",[],[],0.107024928,0.701367736,0.409116805
986352,Im 20 years old weighing 155lbs and my blood glucose ranges from 110-155 is that normal? ,"['Glucose,', '>=', '110,', ',', 'Glucose,', '<=', '155,']",[],[],0,0.544509172,0.287998855
3079464,75 gms of glucose is how much of rice? ,"['Glucose,', '=', '75,']",[],[],0,0.518567681,0.119170755
2881912,Blood glucose readings? Does 152 fasting blood glucose suggest diabetes?,"['Glucose,', '=', '152,']",[],[],0,0.666150808,0.212320447
2084558,How dangerous is a blood sugar level over 600? ,"['blood_glucose_measurement,', '>,', '600,']",[],[],0,0.567984581,0.278763592
3440188,normal levels of glucose treatment for levels of 11.4? ,"['Glucose,', '=', '11.4,']",[],[],0,0.601603031,0.265848726
3215885,My father is 80 and diabetic. His creatinine hovers around 2.0. How can this be brought down? ,[],[],"['Creatinine', '=', '2.0']",0.169395635,0.652936578,0.157944053
3455113,"Im male 45 years old, my creatinine results is 71.3 what is its means? ",[],[],"['Creatinine', '=', '45', 'years', 'Creatinine', '=', '71.3']",0.258027767,0.603058219,0.351861358
140181,i just woke up this morning i took my blood glucose it was 111 is that good or bad? ,"['Glucose,', '=', '111,']",[],[],0,0.591347337,0.150395751
981731,"Should I be concerned if every time I have my blood glucose checked, its always somewhere in the 70s? ","['Glucose,', '=', '70,']",[],[],0,0.606355846,0.144459292
2222803,how to prepare 10mM of glucose solution? ,"['Glucose,', '=', '10,', 'mm']",[],[],0,0.628477335,0.177852392
1611295,Im a 31-year-old male. My random blood sugar level is 86 mg/dl. Is it normal? ,"['blood_glucose_measurement,', '=', '86,', 'mg/dl']",[],[],0,0.590925396,0.238758177
3499293,Does a 3 hour glucose test check for diabetes? The type where they make you drink it?,"['Glucose,', '=', '3,', 'hour']",[],[],0,0.567041814,0.210143358
3692003,3 metabolic pathways by which the liver produces glucose? can include an illustration,"['Glucose,', '=', '3,']",[],[],0,0.66551137,0.273756146
1524144,"My fasting blood glucose was 216, but my a1c is only 5.2. Does this mean that I have diabetes? ","['Glucose,', '=', '216,']","['HBA1C,', '=', '5.2,']",[],0.061785922,0.67097497,0.39271003
2045185,how to control my blood sugar level??its around 500? its very high pls tell me asap...thnx,"['blood_glucose_measurement,', '=', '500,']",[],[],0,0.660562217,0.406533778
1013281,What if my blood sugar level is 289 ? ,"['blood_glucose_measurement,', '=', '289,']",[],[],0.042441856,0.579007566,0.369052887
1139739,is 197 normal for a non fasting glucose .? 5/10 53 years old,"['Glucose,', '=', '197,']",[],[],0,0.537999868,0.25775522
846538,blood sugar level 29? what happens if blood sugar level is 29?,"['blood_glucose_measurement,', '=', '29,']",[],[],0,0.554686546,0.281600148
3455079,my glucometer reading shows my fasting glucose 96. can i reduce my insulin intake from 34 units to 30units? ,"['Glucose,', '=', '96,']",[],[],0,0.66170907,0.289712042
145544,Is this blood Sugar level normal 148mg/dl and am having 86kg? ,"['blood_glucose_measurement,', '=', '148,', 'mg/dl,', 'blood_glucose_measurement,', '=', '86,', 'kg']",[],[],0,0.500269175,0.287486136
1651912,is 110 a normal pre fasting blood sugar level? What is the normal range?,"['blood_glucose_measurement,', '=', '110,']",[],[],0.028278048,0.567377925,0.339159668
993503,"my blood sugar level are on fasting 157, after the break fast-335. what doest this mean? ","['blood_glucose_measurement,', '=', '157,']",[],[],0.0546241,0.631085157,0.408308953
463194,is a blood Sugar level of 199 ok after 1hour? ,"['blood_glucose_measurement,', '=', '199,', ',', 'blood_glucose_measurement,', '=', '1,', 'hour']",[],[],0,0.558146775,0.302936912
126370,i went to the doctor my glucose was 130 is that bad im not a diabetes? ,"['Glucose,', '=', '130,']",[],[],0,0.586804628,0.245188817
775582,can a diabetic in his mid 50s able to bear offspring?his ave glucose daily 150-200? ,"['Glucose,', '=', '50,', ',', 'Glucose,', '>=', '150,', 'daily,', 'Glucose,', '<=', '200,']",[],[],0,0.537493169,0.271955788
3455098,79 blood sugar level after fasting for 12 hours. Is this good or bad? ,"['blood_glucose_measurement,', '=', '79,', ',', 'blood_glucose_measurement,', '=', '12,', 'hours']",[],[],0,0.54441607,0.243758008
675214,Should glucose meter commercials get for real and show a reading of 200+ every now and then? ,"['Glucose,', '=', '200,', 'reading']",[],[],0,0.616123438,0.218195349
2758731,My patient blood sugar level reach 15.5 is this dangerous? Do I need to call ambulance already? ,"['blood_glucose_measurement,', '=', '15.5,']",[],[],0,0.594150305,0.349693209
1603783,5.8 blood sugar levels. normal? is it normal???,"['blood_glucose_measurement,', '=', '5.8,']",[],[],0,0.531363487,0.238953739
1538383,my doctor told me my glucose count was 15 does this mean i might have diabetes.? ,"['Glucose,', '=', '15,']",[],[],0.062215354,0.653631091,0.332740754
853649,5.8 blood sugar levels!? Is this normal?,"['blood_glucose_measurement,', '=', '5.8,']",[],[],0,0.525643528,0.237452388
3516050,Glucose test strip are given 100%correct result? ,"['Glucose,', '=', '100,']",[],[],0,0.64217329,0.117123917
1581072,help! Fasting BS 125!? My blood work came back from the doctor...fasting blood sugar 125.  Do I have diabetes?  Thanx,"['Glucose,', '=', '125,']",[],[],0,0.599349439,0.261011571
187232,"what should be the normal blood sugar level for an adult after meals-1,,,2...3...4  hours? ","['blood_glucose_measurement,', '=', '2,', '...3...4', 'hours']",[],[],0,0.580483973,0.203398109
378245,I did a home glucose test with meter and results non fasting (before bed) was 204 what does this mean? ,"['Glucose,', '=', '204,']",[],[],0.052837211,0.587576628,0.301175296
300924,If you are a diabetic with blood glucose of 13 mmol/l what does this mean? Good or bad? ,"['Glucose,', '=', '13,', 'mmol/l']",[],[],0.067608453,0.640598893,0.31881839
585358,"My fasting blood sugar level 160av and post meals after 2 hrs it is 150 why, am I diabetic? ","['blood_glucose_measurement,', '=', '160,', ',', 'blood_glucose_measurement,', '=', '2,', ',', 'blood_glucose_measurement,', '=', '150,']",[],[],0,0.563676119,0.330005527
1645927,is 110 blood sugar level normal before eating breakfast? What is the normal range?,"['blood_glucose_measurement,', '=', '110,']",[],[],0.028817331,0.600559354,0.295920014
148260,what does a fasting blood sugar level of 107 mean? ,"['blood_glucose_measurement,', '=', '107,']",[],[],0.091854533,0.570337296,0.370863259
1994402,is creatinine level 1.7 high for a man hyoertensive aged 75y? ,[],[],"['Creatinine', '=', '1.7']",0.194260068,0.677285969,0.280653
979273,"What are 2 advantages of when our blood sugar level is high, our bodies converts the excess sugar to glycogen? ","['blood_glucose_measurement,', '=', '2,']",[],[],0.024517522,0.667067468,0.338963151
10095,my mother plasma glucose(random) is 156 mg/dl is it dangerous? thank u for answering,"['plasma_glucose_result,', '=', '156,', 'mg/dl']",[],[],0,0.590414465,0.144026011
50063,if my glucose lavel is more than 300mg/dl how much insulin i have to take? ,"['Glucose,', '>,', '300,', 'mg/dl']",[],[],0,0.670351386,0.29991594
3763188,is a test results in A1C level of 11.5 bad? ,[],"['HBA1C,', '=', '11.5,']",[],0,0.527297854,0.283290803
3401765,My fasting blood sugar is 98 is it normal?i m 32yr male? ,"['Glucose,', '=', '98,', ',', 'Glucose,', '=', '32,', 'm']",[],[],0,0.540046692,0.255840868
3127071,I am 40 . My glucose test result fasting 97 MG/DL and PP 175 MG/DL. Is it normal? ,"['Glucose,', '=', '97,', 'mg/dl,', 'Glucose,', '=', '175,', 'mg/dl']",[],[],0,0.57015574,0.212411031
10143,"How can one reduce high 90s fasting blood sugar to mid 80s? skinny person,exercises every day","['Glucose,', '=', '90,', ',', 'Glucose,', '=', '80,']",[],[],0,0.614423037,0.343283415
805231,what is the best way to control type 2 diabeties? my blood sugar level is 88/110,"['blood_glucose_measurement,', '>=', '88,', ',', 'blood_glucose_measurement,', '<=', '110,']",[],[],0,0.580212891,0.266799569
211628,Is 139 Normal For A Blood Sugar Level? ,"['blood_glucose_measurement,', '=', '139,']",[],[],0,0.48974064,0.263809532
1863485,What are the 5 types of glucose? ,"['Glucose,', '=', '5,']",[],[],0.077892122,0.655497313,0.351757765
3455114,"Im male 45 years old, my fasting blood sugar results is 4.9 what is its means? ","['Glucose,', '=', '45,', 'years,', 'Glucose,', '=', '4.9,']",[],[],0.058305494,0.54913193,0.300799787
1912588,is a 13.8 reading on my glucose machine bad? as I am normal at 7,"['Glucose,', '=', '13.8,', 'reading']",[],[],0,0.614779353,0.283684641
3251157,what is mean glucose? HbA1C  is 7.8. Mean blood glucose is 201.68. Is it normal or higher level?,[],"['HBA1C,', '=', '7.8,']",[],0.100656278,0.735541225,0.443682641
3251157,what is mean glucose? HbA1C  is 7.8. Mean blood glucose is 201.68. Is it normal or higher level?,"['mean_Glucose,', '=', '201.68,']",[],[],0.100656278,0.735541225,0.443682641
3401671,"pre-diabetic fasting blood sugar 78 is it low,and how fast can your sugar drop? ","['Glucose,', '=', '78,']",[],[],0,0.530909002,0.31196484
1556401,26yrs weigh 72kg.is this bad? My blood sugar level is 6.1 what does this mean? ,"['blood_glucose_measurement,', '=', '6.1,']",[],[],0.054641744,0.578128219,0.420163512
380751,normal blood sugar level for 3 year old child? ,"['blood_glucose_measurement,', '=', '3,', 'year']",[],[],0,0.564781487,0.183448538
1917604,can a1c levels be reduced in less than 24 hrs? ,[],"['HBA1C,', '<,', '24.0,']",[],0,0.551500678,0.284429789
602505,"In a blood glucose reading, is 100 considered high? ","['Glucose,', '=', '100,']",[],[],0,0.619849682,0.180212826
450671,my blood sugar level is 7.6 is that to high? ,"['blood_glucose_measurement,', '=', '7.6,']",[],[],0,0.517856956,0.243666664
2758956,How can i lower my A1C its 10.8 ? ,[],"['HBA1C,', '=', '10.8,']",[],0,0.499206483,0.403355718
665717,"My fasting blood sugar is 75,posting is 179.9.Now I thing it is normal.Is it compulsory to use the medicines.? ","['Glucose,', '=', '75,', ',', 'Glucose,', '=', '179.9,']",[],[],0.080139695,0.623742223,0.272453338
3215600,my fasting blood sugar is 173 what can i do? what can i eat in breakfast lunch & dinner,"['Glucose,', '=', '173,']",[],[],0,0.460490227,0.27505073
3780245,"HbA1c of 5.7, am i prediabetic? ",[],"['HBA1C,', '=', '5.7,']",[],0.229666159,0.580785394,0.415806443
1549979,How much is life insurance usually for a type 1 diabetic with an a1c of 7.3? ,[],"['HBA1C,', '=', '7.3,']",[],0,0.640679359,0.277602732
1945491,"My blood group is B+, haemoglobin 10.3 gm%, creatinine 2.03 mg/dl, potasiam 5.2.are these ok if not how to? ",[],[],"['Creatinine', '=', '10.3', 'gm', 'Creatinine', '=', '2.03', 'mg/dl', 'Creatinine', '=', '5.2']",0.145818305,0.628622651,0.175552577
1994161,i have got my fasting blood sugar test report..that is 106 mg/dl..is it necessary to go for pp test ? ,"['Glucose,', '=', '106,', 'mg/dl']",[],[],0,0.568942845,0.219348714
1994299,my fasting blood sugar is 93 & pp is 216 am i diabetic? ,"['Glucose,', '=', '93,', ',', 'Glucose,', '=', '216,']",[],[],0,0.55282402,0.245809913
1330802,I dont have diabetes but my blood sugar level after eating was 142? Is this normal?,"['blood_glucose_measurement,', '=', '142,']",[],[],0,0.563508749,0.220169798
1634127,Is 137 normal blood sugar level about an hour after eating? ,"['blood_glucose_measurement,', '=', '137,']",[],[],0,0.49450922,0.241232842
2069138,i am 50 years old blood sugar level is 78 is that normal? ,"['blood_glucose_measurement,', '=', '50,', 'years,', 'blood_glucose_measurement,', '=', '78,']",[],[],0,0.530973792,0.176196337
2589274,i am 58 yrs old my creatinine are 6.7 how long will i live without dailysis? ,[],[],"['Creatinine', '=', '58', 'Creatinine', '=', '6.7']",0.182453057,0.644083083,0.390773356
53991,my glucose reading 2 hours after dinner this evening was 440. Is that okay until tomorrow? ,"['Glucose,', '=', '2,', 'hours,', 'Glucose,', '=', '440,']",[],[],0,0.588682771,0.259491235
373353,List 2 ways insulin lowers blood sugar (glucose) levels.? ,"['Glucose,', '=', '2,']",[],[],0,0.629989028,0.30863443
45969,is a blood sugar level of 500+ dangerous for type1 diabetic? ,"['blood_glucose_measurement,', '=', '500,']",[],[],0,0.567835689,0.310769558
1645926,why we leave the glucose for at least 2 hour befure use? ,"['Glucose,', '>=', '2,', 'hour']",[],[],0,0.616982341,0.201143086
2826354,"My fasting blood sugar was 157, does that mean Im diabetic? ? ","['Glucose,', '=', '157,']",[],[],0.079016506,0.580370903,0.34470588
652880,Fasting was 102 and A1C 6.1...Doing low carb.. Cholesterol 201....Im scared.....? ,[],"['HBA1C,', '=', '6.1,']",[],0,0.531968236,0.292079836
1994118,my blood sugar level after fasting for 12 hours was 6.6 does this mean i am diabetic? ,"['blood_glucose_measurement,', '=', '12,', 'hours,', 'blood_glucose_measurement,', '=', '6.6,']",[],[],0.07271962,0.62311697,0.382986069
3455144,I had my insulin tested in my blood work it was 4.9 is this bad? my glucose was 85 fasting,"['Glucose,', '=', '85,']",[],[],0,0.661739767,0.256842524
1204107,what is the normal blood sugar level for 27 year old male? ,"['blood_glucose_measurement,', '=', '27,', 'year']",[],[],0,0.571062923,0.22615388
553162,Is my blood sugar too high? gestational diabetes 168 blood sugar level? 35 weeks pregnant,"['blood_glucose_measurement,', '=', '168,']",[],[],0,0.566691637,0.233149782
3780336,is 291 a dangerous blood sugar level? ,"['blood_glucose_measurement,', '=', '291,']",[],[],0,0.486107886,0.257858634
137344,Blood glucose meter reading was 106. Good or bad? Good or bad?,"['Glucose,', '=', '106,']",[],[],0,0.567803979,0.244167358
884940,Is there a blood glucose meter that will measure above 600? ,"['Glucose,', '>,', '600,']",[],[],0,0.495376945,0.267335832
2881861,My father had diabetes and his Serum Creatinine 2.0 and Blood Urea is 70. How severe are these values? ,[],[],"['Creatinine', '=', '2.0', 'Creatinine', '=', '70']",0.173292538,0.702914596,0.131418526
937044,How can a blood sugar level get to 1500....anyone know? ,"['blood_glucose_measurement,', '=', '1500,']",[],[],0,0.651486158,0.297703981
3440084,My fbs test 113 mg/dl and hba1c 5.9% do i have diabetes ? ,"['Glucose,', '=', '113,', 'mg/dl']","['HBA1C,', '=', '5.9,', '%']",[],0,0.560089648,0.378504425
300921,"Oral glucose test: 97, 205, 147, and 63? ","['Glucose_tolerance,', '=', '97,', ',', 'Glucose_tolerance,', '=', '205,', ',', 'Glucose_tolerance,', '=', '147,', ',', 'Glucose_tolerance,', '=', '63,']",[],[],0,0.486126602,0.261605263
3251328,"i have the glucose range fasting 80mg/dl,OGTT 147mg/dl. does i have pre diabetes? ","['Glucose,', '=', '80,', 'mg/dl,', 'Glucose,', '=', '147,', 'mg/dl']",[],[],0,0.602958202,0.356148511
568193,my a1c is 5.4 do i have pre-diabetes? i am anemic and my a1c is 5.4 do i have pre-diabetes,[],"['HBA1C,', '=', '5.4,']",[],0,0.493946731,0.352205098
2589238,Is 99 a low blood sugar level? Im not fasting or anything that is my normal reading.,"['blood_glucose_measurement,', '=', '99,']",[],[],0,0.546498537,0.232818827
3423627,My wife went for a12 hour fasting glucose test result was 131 is this to high? ,"['Glucose,', '=', '131,']",[],[],0,0.530248523,0.092753381
526710,I recently took a glucose test after fasting for 12 hours and the result was 116...what does this mean? ,"['Glucose,', '=', '12,', 'hours,', 'Glucose,', '=', '116,']",[],[],0.053691776,0.553205848,0.348098517
1176100,If my A1C is 13 and have been for about a year should I have pain and headaches? ,[],"['HBA1C,', '=', '13.0,']",[],0,0.543062449,0.286767453
870275,is it bad to fast more than 12 hours for a FBS test? ,"['Glucose,', '>,', '12,', 'hours']",[],[],0,0.421448737,0.198480383
