684951,Is oatmeal a complex carbohydrate? Is it suitable for type 2 diabetics who dont want sugar spikes? ,[],[],[],0,0.591466844,0.269948661
841670,suggest best natural penice enlargement exercize for 50 yr old diabetic man? ,[],[],[],0,0.579555273,0.22936523
108852,weed on the blood test for a pre physical for a employer? smoked 1 weed ago,[],[],[],0,0.616358638,0.117571518
3684904,On the stupidity test level 4 tick tack toe what am I suppose to do? Any suggestions? ,[],[],[],0,0.599247158,0.201940388
3722908,"Use, dosage,side effects of Pause 500 tablet? To arrest bleeding",[],[],[],0,0.586065292,0.187212035
953721,What are the effects of type 1 diabetes on a childs development? ,[],[],[],0.037767747,0.613033056,0.125670373
460838,what is 167 times 47 =? ,[],[],[],0,0.37028414,0.266135007
2826358,what happens to a person healthy if he injects himself with 20cl of actrapid ? ,[],[],[],0,0.661677837,0.281114519
50095,wat should i do if my blood sugar is 66 and i feel really low? ,[],[],[],0,0.670705199,0.305043608
123646,should i inject insulin if my sugar level was 78? ,[],[],[],0,0.5691576,0.284185708
275727,My moms blood sugar is 471..we just found out...what does this mean? ,[],[],[],0.056609627,0.564525485,0.301595956
3414841,"I am a female,54yrs of age,i have high blood pressure,ulcer and diabetic.whenever i talk,there is always this? ",[],[],[],0,0.596428275,0.256685257
1924415,"is 100/49 bp normal. i am diabetic, 40, female.? ",[],[],[],0,0.489942908,0.227753729
3704033,What is 20/100 and 20/200 vision? I have a condition called Keratoconus,[],[],[],0.023119959,0.603614807,0.460389555
1973875,How does taking the gestational diabetes test for 15 min. late after drinking the solution effect the result? ,[],[],[],0,0.64927125,0.166232139
375777,Is a lab value of B12 <1000 normal? Is the lab value for B12 <1000 high or low,[],[],[],0,0.51516223,0.183516324
2488360,how many mg of sodium should i consume a day? im 59 210 pounds ae 19.,[],[],[],0,0.564741612,0.258722246
194875,i need a list of 0 carb foods for diabetics? ,[],[],[],0,0.525735319,0.254101872
1528317,Type 2 Diabetes question? Is Type2 Diabetes and Type 2 Diabetes Mellitus the same thing?,[],[],[],0.104246981,0.625447631,0.344952017
510216,whats a good 2 course meal for diabetic people? easy to cook :),[],[],[],0.026666487,0.569616437,0.155071288
550705,"I have a blood sugar reading of 8.5 @ mid morning, is that bad? ",[],[],[],0,0.561134398,0.21390143
2367538,convert 2400 iu to grams? how many ius equal one gram,[],[],[],0,0.515372753,0.290093333
713918,Can I diabetic die from not taking their insulin for 5 days? ,[],[],[],0,0.576823711,0.276083559
1155690,can diabebtic type 2 people eat food that contains glucose? ,[],[],[],0,0.656734109,0.25175786
41909,CAN you still drive a big truck if you have to do dialysis 8hr a day 7 day a week? ,[],[],[],0,0.484522939,0.077029705
3516164,"my fasting glue level is 120 and hb1ac is 6.2 and post prandial is 136, can i become diabetic? ",[],[],[],0,0.583001137,0.27344805
409874,"I have been peeing,drinking, and and hunry what does that mean? im 14",[],[],[],0.065212556,0.553344905,0.202765763
177109,is 135 bad for diabetes? ,[],[],[],0,0.431646109,0.401013881
2685392,mt tsh lavel is 7.64 what to do? t3 is 131 and t4 is 8 i m facing obesity,[],[],[],0,0.43944332,0.262867749
1096582,blood sugar between 300 and 400 for the last week? ,[],[],[],0,0.469429731,0.205601588
3478281,Is okay if i take 3 caplets of 220 mg of aleve? ,[],[],[],0,0.517081976,0.30395931
3671993,i am aged 40 sys 175 and dia 92 pulse 99/min what is that BP level? ,[],[],[],0,0.510156095,0.248126462
1770308,"Who has done the 3 day diet? If youve done it, does it work??",[],[],[],0,0.518956661,0.269598007
998413,Overwieght!?!?!?!?!?!? I am like 54 and 12 is 116lb to high???,[],[],[],0,0.490447849,0.320702374
1561633,my uric acid level is 537umol/L can u suggest the diet.....? ,[],[],[],0,0.68061924,0.280259043
3172024,blood sugars in the 200-400? what to do--outofc ontrol; feelbad,[],[],[],0,0.570994198,0.272092134
305976,Sugar worse than cigarettes? is a spoon of sugar worse than 2 cigarettes?,[],[],[],0,0.52836293,0.27674675
2758726,How many diabetics eat there way to type 2? ,[],[],[],0,0.680100441,0.272413343
3079554,If a person inject air through 5ml syring can he die? ,[],[],[],0,0.602576494,0.235343903
108890,Can I be a doctor with Diabetes? i want to be an emergency room doctor. i have type 1 diabetes,[],[],[],0,0.566930652,0.075630233
3414965,How much water should I drink a day weighing 207 pound and 59? ,[],[],[],0,0.587068558,0.336743087
1793613,how much is 2cc in a small syringe? i have to give my month old son 2cc of zantac,[],[],[],0,0.557833731,0.235369206
164053,wat is cause o f death of srinivasa naidu?1021? ,[],[],[],0,0.557594776,0.400234222
981720,how can i save my sight if i have diabetes 2? ,[],[],[],0,0.511297107,0.10392727
716334,can a normal or underweight person get type 2 diabetes? and can it be cured? ,[],[],[],0,0.588890314,0.264010757
171780,I am really worried i have type 1 diabetes. What shall i do? ,[],[],[],0.035371213,0.640290499,0.260824084
1623985,what to do after 10th if we wanna be a microbiologist? ,[],[],[],0,0.42315349,0.311180949
3375599,can i give vitamin D3 high potency to a 10 year old boy ? ,[],[],[],0,0.57692349,0.106614575
865558,how many grams asre there in 3.85 mg? ,[],[],[],0,0.569566131,0.294825792
290765,my stoole has been green the last couple times can medicnes be cause?r=1264514184? ,[],[],[],0,0.577883363,0.219385177
1331820,I take janumet 50mg/1000mg once in the am and once in the pm when should i take my lantus? ,[],[],[],0,0.520188153,0.274647892
901710,"Seriously, 20 mg of Cialis does not work. What if I took double? or 30 mgs? ",[],[],[],0.020328832,0.65177381,0.170859814
3401845,Can sloths get type 1 diabetes? ,[],[],[],0,0.601505518,0.286359549
65559,five strategies that can help you avoid type 2 diabetes? need a few sentences on each five plz,[],[],[],0,0.642666876,0.418815911
2919537,why does my 4 year old child crave pure sugar? ,[],[],[],0,0.473077655,0.109009117
1586156,im diabetic and my sugars high what do i do? its 255im not on any meds yet,[],[],[],0,0.564858437,0.251094997
1494901,Will I lose fat and tone my body training in Karate? I am 130kg and have insulin resistance,[],[],[],0,0.592402458,0.369759738
3516129,How common is type 1 diabetes? I need to know the commonality of this certain disease.,[],[],[],0,0.65274936,0.105075248
1214346,i am a diabetic i had 3 seizures over 4hrs but my sugars were hi. Is this possible? ,[],[],[],0,0.575820208,0.428094655
3290485,GLUCOSE LEVEL AT 103? My fasting glucose test level was at 103. Is this number bad.,[],[],[],0,0.631926239,0.344070137
3680882,Whats the life expectancy for someone with neurofibromatosis type 2? ,[],[],[],0.033453384,0.700116158,0.255725652
1165592,"Type one diabetes and weight? If you have type 1 diabetes, do you alway lose weight?",[],[],[],0,0.583652854,0.353813589
587770,is blood sugar 186 bad? I would like to know if 186 blood sugar bad??or am i in danger zone?,[],[],[],0,0.611415803,0.250288308
126387,Which type of diabetes is worse: type 1 or type 2? and why.thanks,[],[],[],0,0.617691577,0.283896506
1188644,what does border line diabeties means and the reading is 5.9? ,[],[],[],0.062284578,0.550755501,0.415673345
1920995,Taking of 30nos of avil 50 mg tablet at a time will leads to death? ,[],[],[],0,0.593061805,0.174997568
951451,Does anyone have a good site that details what type 2 diabetics can and cannot eat? Thanks.? ,[],[],[],0,0.585468769,0.316853881
2310966,my sugar level just after wake upin 10 mins is 98 and after meal its 115 so is it ok? ,[],[],[],0,0.556272388,0.237468064
201972,what if i am on level 28? what will i get,[],[],[],0,0.413149357,0.292713612
605043,Name 2 diseases (other than Alzeimers) that could be treated using stem cells.? Help much appreciated.,[],[],[],0,0.656779409,0.203845143
19907,Is Stevia tolerated well in type 2 diabetics? what effects does it have? ,[],[],[],0,0.553876281,0.261265636
3780165,What type of disease is Type 2 diabetes? ,[],[],[],0.047064129,0.644465566,0.378304452
57922,how does alcohol and smoking affect people with type 2 diabetes? please put reference if possible.,[],[],[],0,0.623440921,0.15884009
1708976,I am losing weight but not trying? about 40 lbs  in a year,[],[],[],0,0.545076609,0.325064361
480633,"if a movie starts at 4:40 pm and is 107 minutes long, what time will it be over? ",[],[],[],0,0.422818244,0.206012279
3608885,"I have diabetes, my blood is over 200, what can I eat? This is for dinner, thank you.",[],[],[],0,0.54522872,0.272840172
80095,is 1300caloriea day  to much have lack of energy@weighing 192 how long does it take to 40lb.? ,[],[],[],0,0.562741876,0.298312217
478274,ordered: 1.2g  On hand: 600 mg/tab How many tablets do you need? ,[],[],[],0,0.57535851,0.086531758
2759002,After having intraocular surgery should the patient expect to recover 100% of vision? ,[],[],[],0,0.586951494,0.166264385
941647,If you have type 2 diabetes how often does one have insulin injections? ,[],[],[],0,0.566302538,0.247557834
1173488,What is meant by BP 120/80? ,[],[],[],0.03414105,0.514332831,0.351492822
3762455,how to find a live donor for kidney? 17 year old girl in need of live donor,[],[],[],0,0.476898372,0.079106942
2685463,im 13 and my sugar level is over 150? do  i have diabetes it was 5 hrs after dinner,[],[],[],0,0.473338008,0.271775931
490293,"Can I give blood if I\m 17, 5\3, and only weight 107? ",[],[],[],0,0.561692357,0.275891244
517282,can you get cancer if you have type 1 diabetes? ,[],[],[],0,0.541758299,0.163879499
3215856,i take 2 water tablets a day can i still drink friut juice? ,[],[],[],0,0.549826503,0.157290623
3171906,my kid of 8years complains of stomach ache immediately after eating? ,[],[],[],0,0.561675012,0.192908078
848850,"Am i overweight - male aged 17, weight: 81 kg and 175cm in height? ",[],[],[],0,0.436055511,0.337676525
1581078,does a 1.5 pottassium level cause death? ,[],[],[],0,0.650431156,0.294782549
741561,HOW MUCH IS 62 1/2% OF %80 ? A)$62B)34C)50D)48,[],[],[],0,0.489718795,0.355967611
3172040,What is the difference between Type 1 and Type 2 diabetes? ,[],[],[],0.049485843,0.631243646,0.330917597
3626179,Is zitotec 200mg a oral tablet? ,[],[],[],0,0.510093689,0.242691726
937035,how much certain prescriptions cost? Depakote 250mg. 210 a month and Lamictal 100mg 90 a month,[],[],[],0,0.591649532,0.202869356
3545714,how can I naturally lower insulin levels? Im a 33 year old female with ovarian cysts.,[],[],[],0,0.620403469,0.187802985
1878358,Which immunoglobulin is the most common in secretions? 1. IgE 2. IgG 3. IgD 4. IgA 5. IgM,[],[],[],0,0.590670884,0.24936533
86753,How to confirm a type 1 diabetes? Are what clinical tests resulting?,[],[],[],0,0.62039572,0.211325899
2758442,my c-peptide test level is 2.68. it is normal. please tell me in detail? ,[],[],[],0,0.573961198,0.167522252
158899,has any1 been cured with type 1 diabetes? ,[],[],[],0,0.590728641,0.146010786
134546,Can someone answer this? HELLPP!!? (look at link) This guy doesnt completely answer the question. could someone give me numbers?http://answers.yahoo.com/question/index?qid=20080912203410AAlgqcI,[],[],[],0,0.572672129,0.164788485
468179,Why at 65 yrs old you need medicare? Or Why is it mandatory to apply medicre at 65 yrs. old?,[],[],[],0,0.555609286,0.339632571
278356,What were the side effects of using animal insulin to treat diabetes? I know 1..immune problems.Anymore??,[],[],[],0.022329915,0.711897552,0.325678766
1775043,How do you fast as a diabetic? I have type 2 diabetes and want to know how to fast healthy.,[],[],[],0,0.639113188,0.362880498
1826049,will a loratab 5/500 make your blood preesure go up? ,[],[],[],0,0.649932861,0.236638367
2518291,what do type 1 and type 2 diabetes have in common? statements are easier not full sentences,[],[],[],0,0.56288445,0.243752942
129119,what does u/L stand for in measurement of cholinesterase level. Ans to rmhungu@mkwasine.co.zw?r=1259072927? ,[],[],[],0,0.645971954,0.340218157
510198,Drinks for a diabetes type 2 diet? breakfastmorning tealunchafternoon teadinnerand a dessert if possible?thanks a million xx,[],[],[],0,0.571780205,0.380361944
2758416,What is the difference between hypoglycemia and type 1 diabeties? ,[],[],[],0.038697426,0.67668736,0.318629026
399712,"metformin+gliklazide+insulin? 2 metformin &2gliklazide, morning. 36mml insulin evening, is this quite normal???",[],[],[],0,0.65224433,0.20978418
242082,Can Honey worsen Diabetes? Can eating Honey trigger or worsen your case of Diabetes (type 1 or type 2)?,[],[],[],0,0.639428377,0.199430794
156399,10 negative things to thanksful for? ,[],[],[],0.118776375,0.553485036,0.266275764
1611276,What does it mean if Im 14 and always thirsty? ,[],[],[],0.106334551,0.63592732,0.305817127
174432,does type 2 diabetes have a cure? ,[],[],[],0,0.553880513,0.231473267
1994064,Do you think someday people with Diabetes can generate electricity while lowering their Blood Glucose? Read this; its quite fascinating!http://www.bbc.co.uk/news/technology-15305579,[],[],[],0,0.634592712,0.074810907
326506,How many symptoms of diabetes can you have if you are a 20 year old? ,[],[],[],0,0.650793672,0.068604529
3440068,Im always thirsty and Im really scared its diabetes or something but Im only 14? ,[],[],[],0,0.517286241,0.119927235
967598,what should not be taken for type 2 diabeties patient? proper diet is must be taken but whay?,[],[],[],0,0.565757334,0.257919043
734108,the normal recommended amount of vitamin c is 1000 milligrams(mg) per day for non-pregnant women. during pregn? ,[],[],[],0,0.567667842,0.133576602
820028,Is $17.99 good for 25 lbs of tomatoes? ,[],[],[],0,0.41291523,0.291546345
3758002,my husband was told today he has sugar and it was 11.0. what dose that stand for? ,[],[],[],0,0.46967724,0.190954834
553151,"If I have type 2 diabetes, does having sex with my wife would hurt/affect me in any way? ",[],[],[],0,0.54753232,0.163582832
1033134,5 questions that you would use to investigate the diet of someone with diabetes? ,[],[],[],0,0.596197128,0.292847246
848881,my iron level is at 6 my legs are starting to bother me should i go to the ER? ,[],[],[],0,0.548611283,0.244646102
262997,How much do you think health insurance coverage would cost a 59 year old man with untreated diabetes.? ,[],[],[],0,0.596840859,0.189084426
887282,"I am 106% Martian, and 62% Aquaman, and 124% Barnicle. Therefore um? ",[],[],[],0,0.557795644,0.117087826
365748,Victoza a new medication for insulin? A new medication for Type 2 diabetes.  How safe is this drug<,[],[],[],0,0.547939956,0.189839542
2589251,what symptoms appear with low hemogloban levels? my hemegloban level was 7.6 would i experience any symptoms?,[],[],[],0,0.68822062,0.180220395
86855,diabetic question???????????????? ok so i just got diagnosed as type 1 diabetic...and im just curious..does smoking raise your blood sugar,[],[],[],0,0.640879214,0.241244048
2758209,my blood sugar is high? its been about 480 and  do not know what to eat,[],[],[],0,0.583141327,0.231727675
83363,What is the vitamin b RDA for a 17 year old female? ,[],[],[],0.027858546,0.670946837,0.286587477
1903793,any potential cures for type 1 diabetes? ,[],[],[],0,0.621741414,0.203603596
2686018,what foods not to eat being a diabetic? i just found out yesterday and mu blood sugar is over 450,[],[],[],0,0.558308303,0.224257156
189826,the effects of acid to :- 1. egg  2.sugar? ,[],[],[],0,0.583866358,0.067007944
41884,I eat about 80 grams of sugar every day total consumption...will i be at risk of diabetes? ,[],[],[],0,0.552125096,0.221578986
1616555,what is symptoms signs of diabetes type 2? symptoms of type 1 diabetes,[],[],[],0,0.569620729,0.20840019
658349,"6.1 A!C, 102 Fasting at Lab, Cholesterol 201.I am doing low carb and lessening my eating will this help.Scared? ",[],[],[],0,0.605636716,0.320203185
2589443,is 15 mg of Klonpopin too much? I also too v valiums this morninf,[],[],[],0,0.616572142,0.178211093
1330924,Are there groups or someone that will help with financial help for Meds. Diabetis and insulin 2x aday? ,[],[],[],0,0.540370762,0.224273294
2686059,my father is diabetic and his hemoglobin result is 103. i would like to know what to do.please advise? ,[],[],[],0,0.678628802,0.280267477
2994520,if u take 5100mm of metformin is that dangerous and what should u do? need to no!,[],[],[],0,0.631536901,0.23832801
555722,why would someones blood sugar be 381? ,[],[],[],0,0.548214912,0.258197844
3414988,"I am a type 2 diabetic, what type of artificial sweetener should I use? ",[],[],[],0,0.621440172,0.175507873
3499186,"wholemealbrown bread? is wholemeal bread fattening, only latley i cant stop eating it. 8 slices a dayok",[],[],[],0,0.577038765,0.254333019
790917,"I am a Type 1 diabetic and my legs and ankles have just swollen up, is there a connection? ",[],[],[],0,0.549452961,0.223295063
3079525,Can you drink alcohol when you have type 2 diabetes.? ,[],[],[],0,0.547886252,0.172464252
72871,my mom is 52 years old .her  fasting sugar is 63.is it normal or  no.? ,[],[],[],0,0.455941737,0.155656904
3215858,i am on 2 water tablets a day can i stilldrink lots friut juice? ,[],[],[],0,0.534703612,0.151869774
1330204,I have type 1 diabetes what are some good free foods with out carbs? im looking for a list,[],[],[],0,0.59369421,0.332748413
2420496,Is she like very badly obese? shes 5 foot 6 144 pounds and 12,[],[],[],0,0.49458164,0.359617055
177058,Will taking 750 mg of tramadol be fatal ? if you mix cyclobenzapr with it will that make it fatal?,[],[],[],0,0.622282982,0.2165187
111949,What are some signs of type2 diabetes in kids age 13? ,[],[],[],0.029946826,0.599640906,0.333996475
3401693,Can i give my patient 18 years old healthy laydy about levocetrizine 5mg bd? ,[],[],[],0,0.57222116,0.228557214
50124,"Has anyone here been diagnosed with LADA, Type 1.5 Diabetes? What do you do to manage it?",[],[],[],0.02531832,0.570290208,0.259848684
1940323,Can being a diabetic stop your period? im 40years old have not had my period n 2months,[],[],[],0,0.585287094,0.063435353
3778529,"Describe diabetes type 2? I need an explained, simple description of what type 2 diabetes is.",[],[],[],0,0.662722349,0.275402606
3478329,cinammon good for type 2 diabetes? ,[],[],[],0,0.58103931,0.278763771
2466843,daughters urine test result-----U protein level-0.08g/l creatinine --10.1mmol/L .is it normal? U  protein/creatine ratio 8mg/mmol is it normal,[],[],[],0.136268053,0.652937472,0.150536716
3770742,How towin candycrush level 125? ,[],[],[],0,0.584097326,0.335560918
3516002,My father is having diabetes mellitus type 2. The angioplasty was done 2months ago. Now his weight is reduced? ,[],[],[],0,0.668692708,0.311713338
1103991,"I have had diabetes for 50 years, now having sudden spells of chills, why? ",[],[],[],0,0.541535616,0.262180567
548260,"hypoglycemia and no diabetes? What is it?it s very strong, every day, 3 times a day.",[],[],[],0.023455664,0.661542475,0.330353439
1439047,can type 2 diabetics eat cottage cheese? ,[],[],[],0,0.612534225,0.439633191
2826413,how serious is type 2 diebetes? ,[],[],[],0,0.596977949,0.307293713
2467192,What should you NOT do/eat if you have type 1 diabetes? ,[],[],[],0.036528572,0.679316104,0.358677924
2685664,"I am a type 1 diabetic, will my pancreas fail? ",[],[],[],0,0.596702695,0.242209822
2084592,sugar level between 140 to 180 which stage of sugar is this? ,[],[],[],0,0.497398138,0.289600939
1165569,Is the blood sugar of 94 bad after eating a couple twizzlers? is it bad after eating 2 twizzlers?,[],[],[],0,0.584075153,0.221113384
824714,"How much is a pint of blood,Type O worth? How come I get paid 25 for plasma?",[],[],[],0,0.535962939,0.105459288
1886837,what r my chances of getting health ins ive had 3 mini strokes high bp diabetic pad? ,[],[],[],0,0.556328297,0.235924244
1692082,"a.m. reading 6.1 took glass of water. repeated test, reading 5.9. Please explain which would be right? ",[],[],[],0,0.516361117,0.099789068
2685315,What of youre in a coma for 16 years? And you havent completed high school?,[],[],[],0.022053405,0.54184258,0.259793311
1717961,How and which ways can severe hypoglycemia be life-threatening to a Type 2 diabetic? ,[],[],[],0,0.666481137,0.32458657
368323,Can someone help  me understand the pathophysiology of type 1 and type 2 diabetes? ,[],[],[],0,0.647750855,0.259003043
675244,MY NEPHEW HAD LIVER BILE RESTRUCTION SURGERY AND HIS SUGAR WENT DOWN TO 3. COULD THIS OF CAUSED A STROKE? ,[],[],[],0,0.628032088,0.222016767
3126960,I had double vision after received faslodex 250 ml? ,[],[],[],0,0.537616551,0.122923933
2286753,"my sgot level is 1548 iu/l , sgpt 2600 iu/l , alp 148 iu/l and ggt 35 iu/l kindly help? ",[],[],[],0,0.482923031,0.262800366
142830,"I suffer from anxiety but also have diabetes type 1, would a doctor still perscribe me beta blockers? ",[],[],[],0,0.639315307,0.166514665
841641,Can drinking alcohol make u do a number 2? ,[],[],[],0,0.554560244,0.15787147
2420520,how long can you live with diabetes 2? ,[],[],[],0,0.459498525,0.26760152
2759088,Red eyes and diabetes? Can type 1 diabetes make your eyes red,[],[],[],0,0.577393174,0.10113886
3031547,What does this mean in a blood test? Alkaline phosphatase high 122 calcium high 10.4 potassium low 3.4.,[],[],[],0.058698378,0.686531067,0.387065411
2069142,my suger was 170 after 4 hours from breakfast is it OK? ,[],[],[],0,0.452245146,0.214416087
239626,can a diabtic person eat corn flour? how much % of sugar is in 100gms of corn flour,[],[],[],0,0.557534218,0.206213385
1767108,"My Potassium level is at 2.2, what is the lowest level a person can survive with? ",[],[],[],0,0.569807887,0.220714957
3423582,What causes both types of Diabetes? type 1 and type 2,[],[],[],0.041086849,0.632224679,0.325905889
3423493,what is the difference between type 1 and type 2 diabetes? ,[],[],[],0,0.557496071,0.240468025
161539,600 Mg potassium of banana will increase how much serum potassium level? ,[],[],[],0,0.585412026,0.269228816
3455117,Is 220 blood sugar good Im 14? ,[],[],[],0,0.521230519,0.280185342
3530454,"Could someone with type 1 diabetes be a vegan or vegetarian? What would the challenges be, if any?",[],[],[],0.025026767,0.577991128,0.088850379
2758435,How many mg in 7.5ml? ,[],[],[],0,0.614403606,0.176381022
1507546,I just ate some cannabis? i just ate some like 2 hours ago and im not feeling anything?,[],[],[],0,0.501744986,0.193021506
69148,Diabetes caused by dirty electricity? - what should we do? Leukemia and Diabetes Increase with Electrical Exposure (EMF)http://www.electricalpollution.com/documents/Hillman/ShockingNewsv5-10262004.pdf,[],[],[],0,0.598687649,0.244189546
2488375,My dog is 1 1/2 and has been diagnosed with kidney failure. WHat can I do? Any suggestions? ,[],[],[],0.134203305,0.625796139,0.137258917
3684880,Can fruit smoothies give you type 2 diabetes? ,[],[],[],0,0.606701016,0.295355767
1830865,My b .pressure is 160 over 110 and today is 120 over 70 is that normal? ,[],[],[],0,0.485726655,0.277734667
432894,"what does it mean to have same fasting and post meal sugar level, both at 170? ",[],[],[],0.069554168,0.544089675,0.455872595
3423559,What would happen if I take one percocet 339 mg? Would I feel loopy and chilled out or what,[],[],[],0.019447343,0.621088684,0.175096959
3323480,need suggestions please? does the 24 hr urine test or regular urine test and kidney related blood test detects diabetes???.,[],[],[],0,0.572004795,0.155330017
832082,"Last night 7.8 random blood reading and tonight 5.4, it is normal? ",[],[],[],0,0.44050324,0.076906741
2758526,Temporary 800kcal diet plan plz? ? ,[],[],[],0,0.535672903,0.418375313
1263394,is 153 an acceptable blood glucose level 2.5 hours after eating? ,[],[],[],0,0.582737505,0.241113067
187263,I think I may be developing Diabetes: What exerecise? Type 2,[],[],[],0.029097735,0.656546116,0.252740681
736593,thyroid level is 80. i am using thronorm 100 mcg? is it correct? Please mail to madhukar_1872@rediffmail.com.,[],[],[],0,0.638587654,0.330224574
263016,"my sugar was 45 is this too low? i didnt eat i was dizzy, sweating, weakness and the shakes",[],[],[],0,0.593939483,0.269907117
177096,What is the latest new injections for type 2 diabetis? Apparently launched in last few weeks,[],[],[],0.021557698,0.573821545,0.21486637
197187,Do diabetics produce glucagon? Do type 1 diabetics pancreases still produce glucagon?,[],[],[],0,0.641701698,0.248076513
2919282,How do you pass level 20 on 100 levels? ,[],[],[],0,0.468325645,0.227476627
415038,My Glucose (fasting) test came back as 106. Im usually arounf mid-90s. Is this something to be concerned abou? ,[],[],[],0,0.611686587,0.191848874
10151,Is losing weight the only way people with diabetes type 2 are able to erase their dark velvety spots? ,[],[],[],0,0.612818003,0.35519892
2084680,is 60 to low of blood sugar when you first get in the morning? ,[],[],[],0,0.571515679,0.250918299
29050,my blood sugar is 590; what should i do? ,[],[],[],0,0.478867412,0.293071598
1664684,type 2 Diabetic snacks? what can a type 2 snack on besides fruit and vegetables ?,[],[],[],0,0.549880922,0.320904493
3734559,"Thyroglobulin level is 170.7, should I have thyroid removed? I have a thyroid goiter with three nodules.",[],[],[],0,0.699938297,0.306287915
3251026,AC1 IS 100 is that normal? ,[],[],[],0,0.403292567,0.073902965
2327868,Can type 1 diabetic women get pregnant? ,[],[],[],0,0.564016819,0.128940582
1221983,i am on amlod/benazp5 20 mg. what are some side effects? I noticed some blood in my stool,[],[],[],0,0.623971999,0.198762357
