3031291,Are doctors near to curing type 1 diabetes? ,[],[],[],0,0.654968858,0.558895469
3563507,My cholestrol levels tested 4.2mmols. is this ok? ,[],[],[],0.10861126,0.544241548,0.737720549
3764639,what if I have sgpt 54 IU/L.is it harmfull.? ,[],[],[],0,0.341042608,0.59803158
3478434,I am 30years man 1 year before my blood sugar 466 now blood sugar 96 now can i eat sugar? ,[],[],[],0.040689001,0.568573475,0.588957429
93287,"Does Azithromycin (Zpak) 5 days, raise your blood sugar? ",[],[],[],0.023844709,0.556081533,0.629278421
3457587,Why is type 1 diabetes so bad? ,[],[],[],0,0.552209675,0.6099329
214126,How to prick my finger without any pain? I am type 1? ,[],[],[],0,0.533193946,0.433893442
3533718,Blood presure question? im 23 male my blood presure is 138 over 98 is this bad?,[],[],[],0.034806076,0.687085867,0.58237505
2758767,what level of this bp? 160/110,[],[],[],0.050961626,0.418701381,0.424458236
295858,What services are available for a person with type 1 diabetes? medical?educational?residential?,[],[],[],0,0.547778368,0.5352844
115021,Is .25 mg of respidol twice a day a large dose for a 5 year old child? ,[],[],[],0,0.467981726,0.446427077
2206355,tricor 160 mg 200 mg? Where can I buy Tricor 160 mg 200 mg,[],[],[],0,0.560853005,0.55309999
1020578,Is it ok to have 2 slices of pizza even if I have gestational diabetes? ,[],[],[],0,0.346982449,0.082336389
3685084,Is 115 unhealthy for 57? Im only 13 and I dont eat breakfast and I dont usually have junk food,[],[],[],0,0.306161195,0.229838044
1330194,What is the average effect of 1 carbohydrate on blood sugar? Does 1 carbohydrate raise blood sugar by 1mg/dL? ,[],[],[],0.036069554,0.613417506,0.620485842
675240,Is a fasting blood glucose level of 3.4mmol/l healthy? I am 17 years old.,[],[],[],0.058986187,0.458114713,0.407266855
3440269,"kidney cyst size 2.8x 2.2cm pain in side and back causing inconvience.loss of weight upto 6%, age42 &wt 65kgs? Male",[],[],[],0,0.61054343,0.674861968
3668216,How to play candy crush level 98 just 15 moves? ,[],[],[],0.029772438,0.519373298,0.146683574
1651870,if i had type 1 diabetes what are the odds of my children having it? ,[],[],[],0,0.595768988,0.59477365
2555347,How do you get Diabetes type 1? ,[],[],[],0,0.47897923,0.708948016
690323,isent it a shambell to ask 50 euro for a blood type test? xx,[],[],[],0.067637114,0.623717964,0.576652706
3455190,Im type 2 diabetic and need to know natural ways to bring down hi sugar levels? ,[],[],[],0.034228876,0.483209848,0.522885561
3401927,How to manage Indian diet & insulin requirement for type1 diabetics to regulate HBAC between6&7? ,[],[],[],0,0.598331332,0.577874363
1027910,is sugar causes impotency? i am 30 years old an unmarried boy.i am afraid that i have sugar problem.,[],[],[],0.088593745,0.574166417,0.429105252
1072682,What will happen if a person take 30 tablets of restyle 0.5 mg? ,[],[],[],0,0.441127181,0.545159757
2149023,is juvenile diabetes the same thing as type 1 diabetes? ,[],[],[],0,0.699911118,0.518577993
347646,Help asap i am really dizzy? ok i am 10 and really dizzy all of a sudden HELP,[],[],[],0,0.420776963,0.16848217
1654617,blood sugar......................................? is 56 in blood sugar before breakfast too low  or its normal low?,[],[],[],0.047244972,0.68574667,0.583171248
41866,If someone who has Pre-Diabetes(and taking care of it) later on will they eventually get type 2 Diabetes? ,[],[],[],0,0.489181936,0.688252926
171828,"what difficult,complex or sensitive issue were u work on with this indvidual? in nvq 3 in care",[],[],[],0,0.520388246,0.393992007
226968,my blood p is 90/60 now what will is a safe bp wile asleep?? it will drop even more...? ,[],[],[],0.020012457,0.628497243,0.410403192
2468966,What are the best vegetables for type 1 diabetics ? ,[],[],[],0,0.469135046,0.499394774
2994607,I have given insulin at 90 degree on deltoid region so any complications? ,[],[],[],0,0.56913662,0.807193995
2758401,my blood preasure is 158 over 83 is that nromal? ,[],[],[],0.023455426,0.656724095,0.483892441
275745,what is this medication used for? what is ciprofloxacin HCL 500mg used for?,[],[],[],0,0.61516726,0.5412848
254325,"Can type 1 diabetics work in  the military? Or anyother government service like the FBI,CIA, or police force?",[],[],[],0,0.532463789,0.434274435
3704019,Took 12 pieces of Exlax? I took 12 pieces all at once. Call poison control or go to hospital?,[],[],[],0,0.454295695,0.486940473
3516040,I ate at 1:30 PM and my blood and urine test 6:30 PM. The result can be rite? ,[],[],[],0.124192274,0.52422148,0.572038412
1806590,sugar level 176 after 2hr after eating? ,[],[],[],0.042167946,0.566606939,0.521172941
313802,Should doing xtc for 3 months give you hair loss? ,[],[],[],0,0.477640778,0.381262004
1971399,I have to go a hospital if my sugar level is 253? ,[],[],[],0.04343142,0.490218163,0.574737728
1556409,Is ad toner safe for a type 1 Diabetic? ,[],[],[],0,0.46179232,0.383718103
860741,Why is type 2 diabetes called  adult onset diabetes? ,[],[],[],0,0.651549816,0.575035155
575813,what would happen if someone drank orange juice that was 3 weeks expired? ,[],[],[],0,0.432821602,0.303935349
1499929,Am I underweight??????????????????????????????????????????????????????????????????????????????????????????? I sm 30 and weigh 64 pounds.  People say I am.  Am I?,[],[],[],0,0.337596029,0.347201228
1566878,How does Marijuana affect type 1 diabetes? ,[],[],[],0,0.584150195,0.520614624
308588,"do they ask about diabetes in an eng 1 medical exam? for eg type 1, 2 or low/high blood sugar",[],[],[],0.019664424,0.685012341,0.599901676
3671982,Does Tylenol raise blood sugar in people with type 2 diabetes? ,[],[],[],0.027584128,0.635211229,0.647747755
3478412,If you suffer from type 1 diabetes can you learn to drive at the age of 16? ,[],[],[],0,0.516825199,0.470760524
308593,"What is suggested for glucose levels, taking glyburide 10mg. 2x day & 5 units of Lantus 1x a day? ",[],[],[],0.024038053,0.62188232,0.582357764
308634,3.)What are the dangers and/or advantages of using insulin shock therapy in treatment of  schizophrenia? ,[],[],[],0,0.542091847,0.537903667
334553,where can i buy Ace Bandages? does anybody know what store sells ace bandages that are 35 inches??,[],[],[],0,0.33596471,0.210896283
592776,BP is 80/35 is that OK? ,[],[],[],0,0.199820235,0.337156534
3251282,the sweetest of ALL sugars? 9 letter word? ,[],[],[],0,0.409891874,0.132944644
2686032,what if blood sugar test is 58? my age 60 weight 164 race - aa,[],[],[],0.070225992,0.648947954,0.619839549
2685200,"If f(x) = x, find f(137)? Since the derivative of f(x) is 1, would f(137) essentially be 1 also?",[],[],[],0,0.383140564,0.430160493
174468,i have been drinking vodka every day for almost 2 years every day im 39 what are the affecrs? ,[],[],[],0,0.457825601,0.25667575
151015,i didnt eat all day but my sugar level is 8.3mmol/l-150mg/dl is this high or worrying.? ,[],[],[],0.035681968,0.51467371,0.415100992
829614,Potassium level was 0.6? With potassium level that low how long is it survivable?,[],[],[],0.05214651,0.717827797,0.60993278
2758831,what if any is the diffrence between novofine 30G pin needles and novofine 32G tip needles used for insulin? ,[],[],[],0,0.591644764,0.583218694
1824438,has a person who has been diagnosed with type 2 diabetes now got this condition for life? ,[],[],[],0,0.669276834,0.501532674
684960,I have a cholesteral level 200 in spain can someone tell me what this would be in England? ,[],[],[],0.029960865,0.398450702,0.152779788
440917,"what are the requirements for someone with type 2 diabetes ? like food, nutrition, sugar requirements",[],[],[],0,0.6126647,0.463068783
3598002,What factors increases the risk of diabetes 2? ,[],[],[],0,0.521590591,0.466552347
76370,"What is the usual life expectancy of someone on dialysis, diabetes, and is 63yrs old.? ",[],[],[],0,0.487997919,0.141184628
1206724,is 160 blood surgar count high? Im 53 yr. old man with blood sugar level 160,[],[],[],0.056294934,0.666779757,0.610004306
96596,Whats a good exercise regimen for someone w/ Type 2 Diabetes? ,[],[],[],0,0.522936702,0.592758596
3215540,Type 2 diabetes symptoms? could pain in the hands and feet be a symptom??,[],[],[],0,0.727532148,0.537384272
3802623,which one of these blood glucose monitors does not require strips or losing blood? These are the links.http://www.cvs.com/shop/Home-Health-Care/Diabetes-Care/Diabetes-Monitors/_/N-3uZ13meg4Z2k?pt=SUBCATEGORY,[],[],[],0.038915666,0.705902934,0.42801109
1994309,i am 5ft 8 and 9 and a half stone am i overweight? ,[],[],[],0,0.32188195,0.363325536
1812549,Diabetes question: That white plastic thing that goes on your arm? http://www.facebook.com/media/set/?set=a.1184301704509.22099.1737261760What is that and what does it do?,[],[],[],0,0.542709827,0.198440135
3626044,What causes teary eyes in Type 2 diabetics? ,[],[],[],0,0.598819137,0.458211243
3731202,my sugar is 59 and how can i make it go to 80-120? ,[],[],[],0,0.40473333,0.433567584
1165593,What is the best insulin pump on the U.K market in 2011? ,[],[],[],0,0.437185973,0.463418365
3215812,can some tell me what my urine indicate I have a Dr. appointment in about a week? Glu-negativeBil-NegativeSg-1.02Blo-tracePh-6.5Pro-NegativeUro-0.2 e.u/dlNit-NegativeLeu-Small,[],[],[],0,0.474606514,0.458177418
563236,how bad is 365 blood sugar? i tested about 1:30  hours after i had a chunck of cake.,[],[],[],0.075707771,0.656043768,0.602413595
3079506,What is 0.5ml in units? ,[],[],[],0,0.386454701,0.214436054
3031391,Is 120 over 88 and pulse 105 okay? ,[],[],[],0,0.24349156,0.431722969
2555284,What happens when your blood sugar is at 480? ,[],[],[],0.035353947,0.551443458,0.59784472
592807,What happnes if you dont take insulin with diabetes type 1? ,[],[],[],0,0.542421818,0.61799711
28891,Just diagnosed with Type 2 Diabetes. How much sugar can one have in a day? Or on a food label? ,[],[],[],0,0.569048166,0.556671858
1494896,Is there a cure for type 1 diabetes? Is there any cure yet? Or tests?,[],[],[],0.056370989,0.413909525,0.633150339
802994,Which are 3 the best books of diabetes causes? ,[],[],[],0,0.451869935,0.164328486
3563527,My blood sugar is 591? Im type two diabetes,[],[],[],0.029212632,0.579580963,0.591267705
115020,what is a INITIAL  MEDICATION RECONCILIATION FORM.SUM 1 ANSWERS QUICK.LIKE IN 5MINS PLZZZ? ,[],[],[],0,0.489217997,0.411029577
3614957,What is a easy healthy weight loss meal plan for diabetics w/ type 1? ,[],[],[],0,0.568798602,0.553425551
3755237,Is a Gamma GT reading of 109 cause for concern? ,[],[],[],0,0.364290446,0.46385777
610816,My B12 level was 300 and my endocrinologist put me on B12 shots im also type 1 diabetic and hypothyroidism? ,[],[],[],0.022435927,0.607214689,0.705031753
2518141,Where to go in a major life ending event with type 1 diabetes ? Serious answers only,[],[],[],0.123850554,0.626589239,0.329117358
3358599,What is type 1 diabetes? ,[],[],[],0,0.459492832,0.529361785
3563554,How does diet help prevent type 2 diabetes? ,[],[],[],0,0.573903322,0.577234089
1047720,How to draw 6 units of insulin on a 1ml syringe? ,[],[],[],0,0.537662327,0.668111563
1775048,Mood swings with type 1 diabeties? ,[],[],[],0,0.658122599,0.525178433
3563555,what is the ICD-9 code for diabetes mellitus with iritis? ,[],[],[],0,0.444252908,0.379551888
1330325,"Type 2 Diabetic, bedtime numbers? What is a good range to be in before bedtime?",[],[],[],0,0.600968242,0.603809416
3780126,My dad is 60years old and blood sugar patient and has joint pain. Can He take REVITAL daily? ,[],[],[],0.016641631,0.524210036,0.504527509
273155,Can glipizide/metformin cause cancer? Type 2 diabetes drug glipizide/metformin cause cancer?,[],[],[],0,0.693701565,0.47310862
1139716,"I took a percaset at 5pm, if I drink at around 10pm will there still be bad side effects? ",[],[],[],0,0.387111366,0.425671011
2555394,Is generic Tegretol XR 200 mg available in the USA? and as a tablet not a capsule?,[],[],[],0,0.458453476,0.537947714
625725,Is Soy milk better for diabetes? Type 2 diabetes btw.,[],[],[],0,0.480926395,0.366114199
3127154,is a 500 calorie diet good for diabetic??? if not what is ? ,[],[],[],0,0.53979075,0.46609807
3439997,What is the a1c for 533? Type 1 diabetic,[],[],[],0,0.546933949,0.655305326
2919408,do you think type 1 diabetics rely too much on insulin pump technology? big paper due in 2 days.,[],[],[],0,0.625388145,0.534046292
153759,IS TYPE 1 WORSER THAN TYPE 2 DIABETES? ,[],[],[],0,0.518469691,0.539410234
3462214,biguanides and diabetes? what is biguanides used for type 1 diabetes or 2?  What are the disadvantages and advantages?,[],[],[],0,0.692353249,0.564976573
3401760,"How long untill you can go home after haveing your thyroid out? For some aged 14year, and is it painfull?",[],[],[],0,0.476153493,0.473357528
3610177,Ketone bodies appear in the urine due to diabetes mellitus during? 1. Ketosis2. albuminuria3. Creatinuria4. Myoglobinuriaplease selct the correct answer,[],[],[],0,0.632583022,0.415011913
1186155,"3 year old daughter with blood,glucose and protein in urine. Is this normal? ",[],[],[],0,0.508475661,0.424007773
114990,My husband has never been diagnosed with diabetes but has all symptoms and blood sugar was 464 today? Any idea? ,[],[],[],0.019020812,0.55091095,0.572513104
3740950,my tsh is .117 should I be concerned? I am taking .88 synthroid,[],[],[],0,0.436293572,0.725302339
531016,HOW HIGH SHOULD A NONDIABETICS BLOOD SUGAR GET AFTER 1 HOUR OF EATING ...PIECE OF PIZZA AND BIRHTDAY CAKE? ,[],[],[],0.01417563,0.436591983,0.340700567
1816189,what sugar level is normal for a cat? my cats sugar is at 380...,[],[],[],0.029169669,0.607099772,0.441106767
3126887,my insulin is 18.9 its high or low ?please help i m confused? ,[],[],[],0,0.62985462,0.729073644
3290347,How many times can the honeymoon phase occur in type 1 diabetes? ,[],[],[],0,0.618155956,0.38281402
1085172,my 3 year olds fasting sugar was 328 is that normal? ,[],[],[],0,0.456564188,0.42783162
3778517,Im a type 1 diabetic and I keep cramping up everyone I play basketball what should I do ??? ,[],[],[],0,0.438453257,0.471402824
918283,"Can people die from Type 1 Diabetes? If so, how? Like how does the diabetes cause a death?",[],[],[],0,0.562333703,0.367080033
734113,What are 5 signs and symptoms of muscle fatigue? ,[],[],[],0,0.486868739,0.512378275
1372877,what % off people with diabetes are fat? And also are you fat thin or got type 1 just wonderin,[],[],[],0,0.551257253,0.409875989
844105,after about 4 hours after eating my blood sugar was 160? is that normal?,[],[],[],0.033964319,0.560127139,0.521851003
3031599,"i have peed at least 20 times today, do i have a chance of having diabetes? ",[],[],[],0,0.485518158,0.401824653
1219282,Any one have fasting testimonies? Im starting a water fast today and i need motivation... im 232 lbs??,[],[],[],0,0.44530803,0.356192589
3172067,Why is weightlifting good for preventing or managing type 2 Diabetes? ,[],[],[],0,0.595275998,0.633110642
937037,Is there a diagnosis for low blood sugars? my blood sugar is 2.5 at the minute. How bad is that?,[],[],[],0.044845897,0.550700307,0.570064604
1331179,What are the best foods a diabetic 50 yr. old should eat? ,[],[],[],0,0.404868484,0.197260171
3685092,My rbc count is 4.3. Am I suffering from anaemia? Normal range is 4.5-5.5,[],[],[],0,0.476495385,0.630271316
1994018,If your 16 and weight 150 can you get diabetes? Height 50,[],[],[],0,0.47473228,0.468796283
1814471,I am not a diabetics.If I will take 20 dionil tablets what is the reaction to me? ,[],[],[],0,0.462531835,0.487084508
3171938,How to bring a 102.3 tempeture down? ,[],[],[],0,0.245935112,0.168281883
28964,Is type 1 diabetes Hyperglycemia or Hypoglycemia? ,[],[],[],0,0.532287359,0.660498023
3516124,Do you think there will be a diabetes type 1 cure? ,[],[],[],0,0.525683999,0.539256334
1837989,I want a sugar mumy of the age 25 and below? 0750718455,[],[],[],0,0.354028642,0.283911139
747271,i check my sugar level in one touch it read 339? ,[],[],[],0.036661918,0.539290667,0.521854103
3031538,Can you get diabetes from Rice krispie treats? i eat about 7 mini treats a day.,[],[],[],0,0.440520883,0.280564249
2076723,can stem cell transplant treat Diabetes? http://www.diabetes-kidney.org/type-1-diabetes/292.html,[],[],[],0,0.666784287,0.491919279
2758642,How many cc of insulin are in 300iu? ,[],[],[],0,0.537279129,0.408675015
3766551,rash between my legs after having sex with my type 2 diabetes husband? ,[],[],[],0,0.641717911,0.401354253
1966595,im thinking about gaining 300 pounds give or take 350 pounds thoughts? ,[],[],[],0,0.363147289,0.290390849
1682514,What is the weight of a Shetland 535? With 75hp outboard,[],[],[],0,0.3181265,0.319349557
1631585,should i take ZANTAC 150 MG IN THE MORNING OR AT NIGHT? ,[],[],[],0,0.341147304,0.461247683
665704,Can boozing too much bring on type 2 diabetes over time? Or does that have nothing to do with it? ,[],[],[],0,0.436772943,0.337037027
1994285,"My hb level is 8 I m very weak, how can I increase the level to 11 or 12? ",[],[],[],0.062750868,0.459460408,0.359968305
2206353,prandin 1 mg 2 mg 0.5 mg? Where can I buy cheap prandin,[],[],[],0,0.513842702,0.488477439
80054,"On an animas 2020 insulin pump, how do you slow down the insulin delivery? ",[],[],[],0,0.618575454,0.578574657
303417,net Carbs? as a diabetic can i eat food that has 18 carbs but 3 NET carbs?? ,[],[],[],0,0.594734311,0.482062101
83383,the reading of sugar (98-110) is normal? ,[],[],[],0,0.447660387,0.410808981
2164856,Is 104 over 56 a good blood presure for a 31 year old woman with two kids? ,[],[],[],0.018534739,0.397805989,0.346127808
65496,my dads sugar is over 400.how high is that? ,[],[],[],0,0.414090723,0.233471364
663333,how much sugar in a 12oz can of beer? how many grams of sugar in a 12oz can of beer,[],[],[],0,0.492005974,0.308995336
652885,high blood surgar levels symptoms over 500? In a 1 year old.  What can happen if not treated promply?,[],[],[],0.047351803,0.757283211,0.621254683
33360,diabetic meal plan for person weighing 230 lbs and 59 years old? ,[],[],[],0,0.591264367,0.315799713
2518155,what is a non dibetic level for a 23 year old? ,[],[],[],0.038794089,0.423023611,0.202650964
2351462,103 at 18.... Underweight? ? I will be 18 in April and weigh 103 pounds. I am 51,[],[],[],0,0.413634598,0.391640127
142879,"Im endocrinologist,like to have a clinical attachment in reproductive endocrinology for 6 months in UK,HOW? ",[],[],[],0,0.615578532,0.453333348
2393414,Who diagnostic criteria for diabetes 2011? ,[],[],[],0,0.528989077,0.237767011
1684901,What is the difference between type 1 and 2 diabetes? ,[],[],[],0,0.557336628,0.546393395
1165583,"Whats the difference between type 1, type 2, and type 3 Diabetes? ",[],[],[],0,0.616895199,0.567202985
37620,I am a type 1 diabetic. What is the chance I will pass diabetes to my kids? ,[],[],[],0,0.465249568,0.559356332
3290537,Is 287 high for an amounia level in blood test? ,[],[],[],0.134101279,0.546967626,0.615872383
3358693,how to strengthen liver for 67 years old diabetic type 11 insulin patient? ,[],[],[],0,0.757753909,0.626543582
3671454,My blood suger i checked after breakfast is 180. i m 25 yrs old. do i have diabetes.? ,[],[],[],0.022103144,0.510743499,0.481991708
375781,Is there a website to interview a person about type 2 diabetes? I need this for a project,[],[],[],0,0.389730603,0.401818335
1085136,blood Sugar of 55 still take insulin needle or no? ,[],[],[],0.028202531,0.672876835,0.676616907
2758759,My father is 80 years old. Diabetic. His haemoglobin count is 9 only. How to build up haemoglobin.? ,[],[],[],0,0.572495818,0.529615521
3031552,0.9 creatine level is that normal for kidney function? ,[],[],[],0.189713517,0.796155453,0.775451481
3780171,Can I get diabetes at 12 and 90 pounds Im just a little freaked out? ,[],[],[],0,0.407261729,0.32981956
2294734,Whats a website that I can buy 1ft 2in black real human hair extension with the clips already on them? ,[],[],[],0,0.371249974,0.060707644
1708955,I am not a diabetic but my sugar is 243 what do I do? ,[],[],[],0,0.446155608,0.474801034
420307,ER 5 On OneTouch Meter? My OneTouch Meter keeps showing ER5 on the screen. Does anyone know what this means?,[],[],[],0,0.4238967,0.37761724
2994610,is my blood pressure ok when standing the reading is 91 over 58? ,[],[],[],0.023299335,0.594017386,0.428965956
1248030,type 2 diabetes what will happen to your body over the long run if diabetes is left unchecked? ,[],[],[],0,0.679031849,0.533575416
1659510,Can I have an extra dose of insulin NOVO-MIX 30 before an unexpected meal? ,[],[],[],0,0.554640532,0.558891296
1173447,"postprandial blood glucose level 166 milligrams is normal or not? if NO, then what is normal level?",[],[],[],0.077016984,0.765169501,0.541304708
976871,If someone is healthy but constantly experiencing hot body temperature since teenage til now that he is 28yrs ? ,[],[],[],0,0.455526888,0.397147894
665715,my girlfriend is pregnant and is a type 2 diabetic and wants an abortion is this good? ,[],[],[],0,0.52124089,0.442743689
2685640,167 and over 90 diabetic on norvacs and lisinipril is my bp to high? ,[],[],[],0,0.59658891,0.510040224
1801858,For someone with type 2 diabetes is eating chili okay? ,[],[],[],0,0.567560315,0.3004933
283259,Type 1 Diabetics- how old were you when diagnosed and what symptoms were you exhibiting? ,[],[],[],0,0.70775497,0.635686755
610804,what does type 1 diabetics have to take tell me specifically.? ,[],[],[],0,0.612920761,0.686911941
305942,I am 52  years old Blood sugar after food 11/2 hrs is 92 mg /dl. is it ok? ,[],[],[],0.019399375,0.528143525,0.642351747
615436,Is peanut butter good for diabetes 2 person to have ? ,[],[],[],0,0.369664848,0.184500441
3386172,Am I underweight please answer?!? Im 54 or 55 and 106 pounds... Am I underweight Im 14,[],[],[],0,0.329068542,0.370297611
15223,How much sugar is in skim milk?I have type 2 diabetes and like milk with one meal? ,[],[],[],0,0.514983654,0.376986921
1692058,"If insulin is unrefrigerated ove 10, can it be use? ",[],[],[],0,0.494159162,0.565527439
1586162,It seems like I might be at risk for Type 2 Diabetes. For what symptoms should I look out? ,[],[],[],0,0.460994124,0.660037756
3780233,Should I take lisinopril in the am if usually take at night with bp158/98? ,[],[],[],0,0.453875095,0.43033573
443347,What is the average age of a person when he or she get Type 2 diabetes? ,[],[],[],0,0.563796282,0.547474742
1493913,how to becom slim in 1 month? i want a good answer plzzzzzzzzzzzzzzz.................,[],[],[],0,0.431861937,0.217557848
3455202,my triglyceride level is 1400 what di i do to lower it? ,[],[],[],0.036071556,0.606842816,0.274241507
3684893,my TSH level is 12.5 and i taking 25 mcg thyronorm it write for me? ,[],[],[],0.029135778,0.574738026,0.571126938
2685537,Is 61 normal blood sugar for a two year old? ,[],[],[],0.030097032,0.499418855,0.529962838
3779980,i was told i have sugar in my urine but tested blood sugar it was 123? ,[],[],[],0.099738568,0.713339627,0.616097927
986334,lipitor or vytorin which one is good for type 2 diabetics? ,[],[],[],0,0.719064713,0.663248539
899378,"Does Calorad MG work? If you have tried it, does the 3 month Calorad MG plan work?",[],[],[],0,0.379432261,0.643497765
1994505,how much sugar is reduced by 2 units of insulin? ,[],[],[],0,0.660472214,0.569016278
3478180,MY MCHC IS 35.8 g/dL is it alarming? my MCV BLOOD TEST IS 87 AND MCH IS 31pg,[],[],[],0.049325726,0.473156184,0.76138711
164054,wat is cause o f death of srinivasa naidu?1021? ,[],[],[],0,0.467188269,0.335667282
3462327,What food should I avoid? I have Type 2 diabetes and struggling to get the blood sugar levels down.,[],[],[],0.066787395,0.595235825,0.625638247
1201494,Does staphyllococus aureus affect ones fertility and 2 what extent? ,[],[],[],0,0.546257377,0.536312282
1067715,Potato bread has less carbs then wheat bread so is it ok for a type 1 diabetic to eat? ,[],[],[],0,0.494535953,0.437210739
420336,for how long kestine 10 mg tablets once daily can be used? ,[],[],[],0,0.515484095,0.52701354
1540930,Can severe Stage 2 diabetes lead to Alzheimers disease? Sorry  Type 2 Diabetes :) Sorry ,[],[],[],0,0.726335883,0.610967457
2069124,I have a blood test on monday Oct. 31 checking for cholsterol and i recently smoke. The thc show up? ,[],[],[],0.057237782,0.559217393,0.480519056
177103,can i trip or get high off of lisinopril? 10 mg,[],[],[],0,0.568657219,0.445010215
57968,can anybody please help me and tell what kind of food is forbidden when using isosupra 16 mg? ,[],[],[],0,0.502314329,0.457028002
267892,where can I find diabetic shoes  in the md/dc area? New Balance 811,[],[],[],0,0.410641164,0.173743159
1822733,how much weight can you lose water fasting for 4 days ? ,[],[],[],0,0.536327839,0.360262096
619395,how much insulin should be taken if blood sugar 192 after dinner? ,[],[],[],0.025931859,0.676932454,0.559114635
166626,why is insulin not always used wiyh type 2 diabetes? ,[],[],[],0,0.694658518,0.567589045
1131741,how much potassium is in 1 banana? ,[],[],[],0,0.542530656,0.402407885
108916,My blood uric acid level is 6.8 mg/dl .is it serious? ,[],[],[],0.206255797,0.631891847,0.690945447
894520,Is it possible to get diabetic neuropathy at age 30? ,[],[],[],0,0.487909943,0.335730583
142863,can type 1 diabetics have kids? ,[],[],[],0,0.618581474,0.538863778
1198931,how bad is 28 blood sugar? ,[],[],[],0.040964449,0.568104744,0.644387484
889747,Are you aware about diabetes type 1? Do you know everything you can about diabetes? reply with what you know.,[],[],[],0,0.602584004,0.546458721
2758838,Is sugar levels consistently over 200 with insulin dangerous ? ,[],[],[],0.041571887,0.539818168,0.535260141
