1662073,"in diabetes (not on medication), is skipping meals/fasting good? ",,,,0,0.539644659,0.207341939
10040,What kind of fruit can diabetic people eat the most? what fruit do people that have diabetes eat the most?,,,,0.022252409,0.614795208,0.323633641
3290411,What causes diabetes to show up? What causes diabetes?,,,,0.066499538,0.688405991,0.356125265
984048,The percentage of glucose present in the normal urine is? ,,,,0,0.653797865,0.125545934
3763977,is there any relationship between usage of salicylic acid ointments and diabetes? ,,,,0,0.53262794,0.143308714
69253,where is the langerhans islands? ,,,,0,0.38623783,0.112188883
587747,why does medicare giving out free power wheelchairs? i just want to know why medicare does :),,,,0,0.500418901,0.244060144
1994529,"Side effects of the drug, Metformin? ",,,,0,0.518663466,0.175815105
3735990,what is vagal symptomes? and why does this happen?,,,,0,0.587146998,0.098501392
2045215,What is the connection between High Blood Sugar and Strokes? ,,,,0.035569762,0.558154762,0.330711693
3668240,How to keep cut on foot clean if you're diabetic? ,,,,0,0.508583903,0.147113785
2518202,I need a caring sugar daddy to take care of my needs.....really serious about it.....i have younger ones looki? ,,,,0,0.591201961,0.217511863
927507,what food is good for diabtetes? ,,,,0,0.516479015,0.266620576
339854,Is maple syrup ok for diabetics? ,,,,0,0.496338904,0.200193971
1942004,What happens when you mainline (inject) nyquill? Just wondering,,,,0.025681099,0.756678402,0.073440656
1675074,when you cycle off of jack3d is it ok to take force factor wile your not taking jack3d? ,,,,0,0.56304729,0.349494666
239634,What is a charcot foot? ,,,,0.038530316,0.537882447,0.207221359
2518336,What type of VLCD shakes are good? ,,,,0.033791122,0.562523425,0.337859005
3414962,Where to buy Metformin online without prescription? ,,,,0,0.595161319,0.233916789
148300,When the laboratory takes a blood test? which one is the name of the one for liver function? Thanks......,,,,0,0.640764833,0.294072539
729188,What is the job title of a person who gives injections? ,,,,0.029218998,0.593429804,0.311363697
3515919,How could Sulfamethoxazole (SMX-SMZ-TMP) affect blood sugar levels? ,,,,0,0.677850962,0.320227593
3516109,What is the best way to control sugar?? please reply me..? ,,,,0.031197291,0.596640945,0.271365643
2589438,A hyper-secretion of ADH can cause a condition called diabetes insipidus? true or false?,,,,0,0.626539946,0.427824259
2173160,Is curds with sugar good for health? ,,,,0,0.47348696,0.352222741
2881765,What does a high reading of glucose serum mean? ,,,,0.122972472,0.725613475,0.447426975
3358581,why do we (as humans) need to make insulin??? HELP QUICK!! HOMEWORK!? ,,,,0,0.572301924,0.215372443
3440144,Can i eat sugar can with my diabetes? ,,,,0,0.489047647,0.256584942
2919290,what are the common disease which may give rise to chronic renal failure? ,,,,0.094978535,0.572630882,0.270776033
790943,i am selling my kidney but i don't know where to sell it? ,,,,0,0.484440625,0.146679834
1621538,Which of the following is associated with diets high in added sugars? hyperactivityTooth decaydiabetesall of these,,,,0,0.594873667,0.345071286
76456,Is it possible to have really good blood pressure and be Diabetic? ,,,,0,0.577306151,0.307317376
670482,"During an eye exam, what condition forecasts diabetes? ",,,,0,0.481999725,0.254053295
3499256,"Machanism of action for thiopental ,propfol ,ketamine? ",,,,0,0.572600186,0.283412516
1677658,Why can't diabetics take insulin as a pill? ,,,,0,0.573014855,0.256455123
3499312,is there a cure for diabetes? ,,,,0,0.487400532,0.052540194
3172139,Is gestational diabetes bad for the baby? ? ,,,,0,0.516045451,0.520780325
153807,how make you own dextrose? ,,,,0,0.498367071,0.179204077
3478443,Is the urinalysis for a cdl physical test for drugs or just for health? ,,,,0,0.540486455,0.226754084
3780276,Urine Test Diabetes? can you drink water before you go to a urine DipStick Test,,,,0,0.589070261,0.148427188
158895,an abnormaly low leval of hemoglobin is called ? ? ? ? ,,,,0,0.629807353,0.343932837
839281,How does diabetes affect kidney function? ,,,,0,0.58313489,0.21272406
2994560,Is there any possible way to completely cure diabetes so that it will never come back again? ,,,,0,0.568717361,0.141921982
41868,should i marry a diabetic patient? life with diabetic patient,,,,0,0.453665257,0.244985879
1910855,can having your gallblader out cause dirrehra? ,,,,0,0.479981273,0.221889019
3499263,What are the signs of kidney failure? If there are any normal symptoms,,,,0.174101688,0.626132786,0.296070635
3126617,Is it possible to be tested for *diabetes* without having blood drawn? I have a strong fear off needles,,,,0,0.563493371,0.19873333
3478185,"How did you find out that you have ""gastroparesis""? did your body gave you any signs? ",,,,0,0.56206125,0.276804149
904030,diabetic and eating disordered cant deal with either ? ,,,,0,0.572054505,0.178664327
3215691,What's best for a diabetic trying to lose weight to eat before and after a run? ,,,,0.029493883,0.606749415,0.406319141
805240,Why wounds don't heal in Diabetes ? ,,,,0,0.540784717,0.152334347
2488390,where can I buy body ph level test strips? ,,,,0,0.412666798,0.064545736
1896915,where can i buy anti-a anti-b serum for blood testing purpose? ,,,,0,0.560993612,0.074184038
870266,effect of diet high in sugar? ,,,,0,0.542319655,0.24728924
3250979,How are elevated levels of Ketone bodies may be found in a diabetic individual? ,,,,0,0.612038732,0.291878581
1013304,low blood sugar - what is best to give orally? ,,,,0,0.55084002,0.145432413
2555480,What foods keep blood sugar stable? ,,,,0.034668712,0.570537806,0.266873092
1331293,Why do I crave sour things now I have hyperthyroidism ? ,,,,0.107290736,0.580919504,0.153020844
390758,Does sugar really make u hyper? ,,,,0,0.592711926,0.280461013
1601396,"if to increase sodium i take? salt or soya sauce,my bp may increase.secondly what r sodium and potassium toour body?",,,,0,0.613409817,0.200500414
3290522,what to eat with diabetic? do not know what you can eat with diabetic,,,,0,0.480298936,0.241268575
1682506,Has anyone exPerienced confusion difficulty concentrating or thinking almost fainting with metformin? ,,,,0,0.619651973,0.334780037
2351472,How much insulin to kill self? ,,,,0,0.628090918,0.250019193
1931584,Factors affecting antigen and antibody? ,,,,0,0.533714533,0.182136506
311190,Has there been updates for insulin intake through the skin? ,,,,0,0.574806929,0.21803166
939333,fruits are rich in glucose content and suggest some fruits for diabetic? some fruits with low glucose please mention,,,,0,0.59071976,0.319578648
1933392,"what is felacio, how is it administered? ",,,,0,0.421206176,0.202644512
171809,Does anyone know if Michael Jackson's toes are magnolia toes with pulse in ragence? ,,,,0,0.56685555,0.126404733
45899,Poll: Do you have a family history of Diabetes? ,,,,0,0.432573855,0.272766709
976846,"i have an erection???????? It seems my penis is really hard, who whats to see? give me your email",,,,0.019830725,0.600736022,0.192051098
834568,"When your Blood Glucose is high, are you less tolerant to pain? ",,,,0,0.635048032,0.091793992
877409,I think I have diabetes... What do I do? ,,,,0.063416258,0.50405705,0.17704016
1022975,any complication for insulin dependent diabetes patient while air trip? ,,,,0,0.569657862,0.235510632
1119032,What's the difference between parkinson's disease and turrets? is there any cure to them? Thanks,,,,0.025991026,0.644573689,0.267994762
1163128,what is the dosage for glucose? ,,,,0,0.568095088,0.19507435
894510,which hormone controls the level of sugar in your blood: adrenaline or insulin? ,,,,0,0.559112549,0.269469202
2589396,ACTH target tissue and effects? what tissue does Adrenocorticotropic hormone target and what are its effects?,,,,0,0.640869021,0.121185549
585356,"Insulin administration. Which one is to administer first, the NPH or Regular Insulin? ",,,,0,0.5880059,0.25045377
2685509,What kind of medecine i drink if my cock c0ming astrong? ,,,,0.022982506,0.612727881,0.303815126
3482814,Blood Test and Hematology Test - What's the relation between the two? ,,,,0.028607587,0.636905253,0.188271582
9926,"please share with me how to cured my diabetics.medicine name,herb etc.thank you? ",,,,0,0.563347936,0.12371324
1331916,how can diabetes works a risk factor for gangrene ? ,,,,0,0.563237429,0.1904625
1826039,how does diabetes affect peoples rights? ,,,,0,0.574819326,0.196659401
550700,how do you know when your sugar is to low or to high? ,,,,0,0.525734842,0.216245145
1163112,do antidepressants or antipsychotics age your face? ,,,,0,0.516356766,0.244208783
2685797,what is the life expectancy for someone with klinefelters syndrome? ,,,,0,0.587590277,0.147925735
1108697,What's diet to be given to a paitent suffering from kidney failure ? ,,,,0.138439793,0.635595083,0.3874048
1920975,Whats the food with the most sugar? I need to know,,,,0.048247632,0.586876631,0.261822641
2826150,How do insulin make the glucose go to the cell? Please answer!? Can you explain how?,,,,0,0.655282378,0.229285121
1183653,Can any one tell of the best treatmeant for hyperthyroidism ? ,,,,0,0.493008316,0.392177194
86842,Tattoos and diabetes....? How bad is it for a diabetic to get a tattoo on the leg?,,,,0,0.572430134,0.135292172
50103,Is it true that diebetic must not consume refined sugar? ,,,,0,0.536561787,0.197491616
3545817,"What do i do if i have a strange urge to drink blood? And never get scabs, cuts, or scars...?",,,,0.01984741,0.652994216,0.131299019
1245424,how much blood can you loose at a given time before coming anemic? say a table spoon per day.,,,,0,0.574150384,0.233450353
3586017,Lord sugar? the eprencees? Dose anyone know when the next appreciate is!?,,,,0,0.609757304,0.343482375
468174,how to lower down fasting blood sugar values fast? ,,,,0,0.515592814,0.270618558
2343753,Weight loss tips for someone with alot of weight to lose? i have fifty pounds to lose any tips,,,,0,0.560879588,0.30334115
2826385,a spoonful of sugar doesnâ€™t help the medicine go down IF YOUâ€™RE A DIABETIC!? This one's not a question.,,,,0,0.627854347,0.310085237
1771840,Can Diabulimia really cause serious blindness? ,,,,0,0.615100443,-0.040438019
655743,if you had blood work done to test for being a diabetic..is it possible the results are wrong? ,,,,0,0.625078201,0.137147322
765292,Is bubbly pee in a male a sign of diabtetes? ,,,,0,0.514739752,0.345501989
1817759,does diabetes affect you wen trying to get pregnant ? pregnancy ?,,,,0,0.615927815,0.183177263
2084580,how long dose insulin show in urine test? ,,,,0,0.573310137,0.219836623
668079,Why do I drink too much alcohol? ,,,,0,0.466542453,0.171204716
1037807,Do ants urinate or not? ,,,,0,0.468750298,0.153696984
2555067,What can I do to stop eating I am a depression eater and I am afraid I'll get diabetes? ,,,,0.024034733,0.614801288,0.136493459
2430725,I Have Arrhythmia And I Might Have Diabetes. ? Would Diabetes mess with my arrhythmia? Please help me.,,,,0,0.542225838,0.231873587
445686,Which is (are) the predominant second messenger(s) involved in regulating glucose metabolism? a.Insulinb.Glucagonc.Adenyl cyclased.cAMPe.all of these,,,,0,0.643481195,0.275535971
260253,People who have diabetes-how do you eat? ...? what would be a meal plan for one day?,,,,0,0.527721524,0.212726623
1263399,What are some signs/symptoms of progressed untreated diabetes complications? ,,,,0.027426499,0.666637421,0.351853669
1803467,can i take phenazopyrid befor a urinalisis to test for a bladder infection or will it interfear with the test? ,,,,0,0.624803603,0.061399531
2319464,Is there any anabolic steroids that won't raise you insulin levels or sugar? ,,,,0,0.568980694,0.310907722
660965,what is diabetes and what causes it? ,,,,0,0.537513614,0.233713806
2247469,"Thomas is a diabetic. White at work, he began to tremble, was somewhat disoriented, and showed signs similar? ",,,,0,0.603378058,0.152174681
28898,Tell how diabetic diet work? ,,,,0,0.481845021,0.349776566
543362,Is cran-apple juice good for the kidneys? ,,,,0,0.516110957,0.206332266
2758798,LOWER BLOOD SUGAR READING FAST? ,,,,0,0.515442193,0.250914067
3290676,How much should be blood sugar for normal person be ? ,,,,0,0.578194678,0.276449353
1931566,pl z told me good medical site to get any type of information about the human body? ,,,,0,0.57482338,0.244092539
1564223,is there a vitiman to get big? any other pills to get mass. they don't make liver pills anymore.,,,,0,0.59499073,0.267412245
590241,Describe diabetes mellitus? Thanks for helping(:,,,,0,0.562409818,0.266607523
870280,"Underweight people and dehydration? Do underweight people dehydrate quicker, and therefore suffer from constipation?",,,,0,0.614038706,0.233887315
3126961,It is expensive to cut the feet of the people who is diabetic? ,,,,0,0.487191081,0.219841674
1643377,if a diabectic has septsis after amputation and renal failure what is the prognosis? ,,,,0.096669425,0.575799584,0.327550232
142883,Is there a food out there that will lower Potassium levels in a Dialisis patient? ,,,,0,0.518486798,0.285833597
780938,explain negative blood type? o neg,,,,0,0.609633088,0.26015228
2759102,How does homeostasis work during Diabetes? Please include positive and negative feedback.,,,,0,0.672006726,0.160176188
86833,ingrediants of Nutrilite? does any one no the ingreddiants of Nutrilite,,,,0,0.593635738,0.245967314
251778,want to know if mullberry tree leaves can treat diabetes? to lower blood glucose the leaves of the mullberry tree?,,,,0,0.591291785,0.171816647
1116429,Do apples have sugar in them? ,,,,0,0.405409813,0.279058993
3215618,Is a diabetics person body unhealthy? ,,,,0,0.499215841,0.221932411
321542,"After eating, what is the highest that blood sugar should ""spike""? Just curious.  I been told many things.",,,,0.082368551,0.64211899,0.144557864
495215,is cabbage bad for diabetics? ,,,,0,0.487722993,0.21870552
169174,Why are obese people more susceptible to diabetes? ,,,,0,0.583392859,0.232097626
1994251,"i am diabetic why does my hand, feet legs, shoulder all cramp? ",,,,0,0.435184687,0.22360158
3423542,If my blood pressure is fine and normal could I still possibly have or get it diabetes? I'm really worried..,,,,0,0.610818625,0.120609045
1330609,does parmalat milk let your sugar rise if you are a diabetic? ,,,,0,0.556233525,0.238042533
2351435,Does red wine have any effects on insulin? Are there any benefits or problems?,,,,0,0.604001641,0.109635428
164075,is there any special instructions to follow before going for blood studies? ,,,,0,0.479339808,0.251052141
3515809,What are some signs and symptoms of your iron level being low? ,,,,0.036685658,0.625876844,0.288690925
2759053,what is an insulin pump? facts pleasethx:D,,,,0,0.600673437,0.259181768
2222771,high blood sugar and acidosis? why does a patient with high blood sugar need to be monitored for acidosis?,,,,0,0.587321878,0.215969712
2132032,What's the deal with hcg and Optimal hcg? ,,,,0.024024823,0.579517126,0.335540891
1614002,what is mean by liver echogenic? ,,,,0.085504479,0.639746487,0.3085168
19763,WHAT FOOD SHOULD BE MOST CAREFULLY AVOIDED BY THE DIABETIC? ,,,,0.022309602,0.53565824,0.239144683
1616577,can anyone help me with the operational definition in regards to obesity? My son needs help for school? ,,,,0,0.516283095,0.125288263
355501,I love you man... have you ever seen that movie before? ,,,,0,0.379356593,0.135010019
3414831,"tell me the symptoms of your diabetes, is it all a pain in the ass? ",,,,0,0.550694943,0.21567826
910977,is it possible to have Acanthosis Nigricans and not have diabetes? ,,,,0,0.570877075,0.266217589
1969024,Why cant you eat before a glucose tolerance test? ,,,,0,0.595113993,0.169986382
887275,Can i have some enzyte? i have a tiny d*ck,,,,0,0.475382209,0.228486955
1699779,Hi hw do i make a cake in the blender usein sweetener instead of sugar? ,,,,0,0.504891098,0.127602637
1153013,vitamin for the good level of seretonin? ,,,,0,0.592363954,0.233499825
96570,"diabetics:what food/foods have you found that? lowers your sugar level (or keeps it low)For me, it's broccoli and blueberries",,,,0,0.592363,0.308681727
251783,what is ticlopidine hcl? recomender for plavix alternative,,,,0,0.663115501,0.170497716
1227264,"Blood Pressure Monitor? Which one is the best: Upper Arm or Wrist and why..Also, any recommendation",,,,0,0.591600835,0.198971003
1553903,How much is too much sugar ? ,,,,0,0.430643976,0.269014329
2310936,"Can diabetics give blood? Not sure on this, thanks for the help :)",,,,0,0.559571624,0.135184512
2685198,why is every1 so obese these days?!?!? whay is every1 (but me) obese?!,,,,0,0.530501306,0.172201216
918272,what does metformin do? my doctors are prescribing me metformin and i really dont know what it does. any help?,,,,0,0.655785382,0.212003931
117822,diabeties ijection can it kill? if you take insulin when u are not diabetic can it kill u ?,,,,0,0.644517779,0.304295212
3127124,system of blood circulation in brain? system of blood circulation in brain,,,,0,0.55549252,0.132533431
1530840,What are the symptoms of a thyroid condition ? ,,,,0.039912988,0.65172255,0.352657497
373366,what does it mean when your insulin is to high? ,,,,0.13208934,0.613626719,0.337077737
1621536,Will taking a glass of glucose drink for energy lead to diabetes? I mean daily taking a glass of glucose ,,,,0.040347447,0.614407182,0.152855605
1186162,can stress cause diahrea and constipation? ,,,,0,0.652060628,0.075388506
1121580,can a kidney be transplanted twice? ,,,,0,0.430697382,0.03365178
2045296,"On blood thinners, how can I stop bleeding when I cut myself? ",,,,0,0.54395318,0.097920343
1204104,What is sugar fructose composed of? ,,,,0.035682422,0.59558326,0.396235883
2468712,Is raw sugar low glycemic? ? ,,,,0,0.483955383,0.286052316
2351447,what would happen if i someone were to give up sweets for a really long time? and i love sweets!,,,,0,0.536595106,0.055505492
41851,should a diabetic cat be allowed unlimited access to drinking water? ,,,,0,0.529105306,0.120698504
1060133,How to tell what blood type i am without a blood test? ,,,,0,0.547779083,0.147126019
3684803,What should pcod patient avoid for betterment / in diet or in daily routine ? ,,,,0.024795777,0.628889918,0.347841144
595379,"What's the difference between "" improving blood sugar metabolism"" and ""improving blood sugar "".? ",,,,0.022524333,0.604349494,0.320827305
853630,what causes diabetes? is sugar one of the causes?,,,,0,0.619016409,0.333692849
123591,"I know a man that is hypoglicemic, why does his sugar drop after a large meal? ",,,,0,0.582353354,0.269945025
2467082,what number is borderline diabetes? what number is borderline diabetes,,,,0,0.503534496,0.337649882
219384,"For a diabetics patient what is the best drink gin, vodka or whisky or beer ? ",,,,0,0.486911148,0.159863934
1722391,what does it mean if your a O blood type? ,,,,0.162736383,0.57341814,0.259038955
897019,how does diabetes mellitus relate to glucose? ,,,,0,0.629866779,0.229123652
108860,Please tell me acceptable level of weight of towels? Want to know how much tolerance is acceptable of towels.,,,,0,0.51597625,0.205554768
1055095,tubligaion incision healing? How long does the tape stay on icisions after my tubligation,,,,0,0.59509325,0.099443197
1209373,what is the prognosis for a dog with diabetes? ,,,,0,0.416246951,0.221633017
741570,"Can a diabetic eat the seeds of a jackfruit? also, please tell me what the jackfruit seeds contain...",,,,0,0.573700607,0.123015665
3031589,How to treat diabetes?? answersfull? ,,,,0,0.54469049,0.278774023
2518470,"When administering the lethal injection do they sterilize the needle,? Is there any need Really",,,,0,0.642512083,0.19478029
1258240,Dwarfism is a condition of what? ,,,,0,0.590285659,0.385305613
3478421,Is shell fish bad for diabetics? ,,,,0,0.48719424,0.128664851
1196418,Are Brussell Sprouts a low GI vegetable and healthy for a diapetic to eat? Good for a diapetic?,,,,0,0.580089331,0.329129636
1933400,Can u eat before taking a hormone blood test? ,,,,0,0.55915606,0.186663419
214109,is there a conection between rage and diabetes? ,,,,0,0.57831347,0.187173933
3620830,Is it better to eat to hand betten rice instead of polished rice to control sugar? ,,,,0,0.471077055,0.204781771
313846,can a lab german shepard be used as a seizure dog? ,,,,0,0.539613366,0.029791616
3516016,What happens to my baby if i dont watch my sugar and i am diabetic? ,,,,0.03078596,0.638597369,0.310468376
1186159,what are the nagitive side effects of coffee? Are there many bad side effects from drinking coffee/,,,,0,0.608920932,0.136692479
711206,what are the numbers that show you have diabetes or not? ,,,,0,0.450377852,0.282242358
2758972,How can i find out my blood type ? I need to know my blood type,,,,0,0.618988752,0.189701423
3728429,Why does my mother habit to drink sugar and water? ,,,,0,0.555374026,0.242210716
79956,"Why is diabetes called a ""disease""? Sounds more like a disorder? ",,,,0,0.636646271,0.359689176
1566846,blood supply of liver is? ,,,,0,0.51295507,0.161917284
2919565,where to buy stevia plant in delhi? ,,,,0,0.461427331,0.218176276
1545893,does grape juice help lower blood cholestrol? ,,,,0,0.561382294,0.199728787
1263395,Does Insulin need a Mini Fridge reallyy? Does Insulin need a Mini Fridge really,,,,0,0.63338697,0.17044054
2994559,just how healthy is diabetes? well i think its pretty healthy to have diabetes. obesity helps the heart brothers,,,,0,0.635778904,0.353496671
839308,"Iam diabetic can I drink red wine? Type II, and also hypertensive but under medication.",,,,0,0.596295357,0.163460627
2149196,"______ GLucose enters a liver cell through a protein channel? science ,",,,,0,0.592375934,0.258002281
3674656,how do I get metformin? ,,,,0,0.480669141,0.237898529
658376,i crave ice all the time and am not pregnant.? ,,,,0,0.418684483,-0.022719365
1502675,what will happen if hematuria is untreated? ,,,,0,0.662779689,0.193178564
2367548,Type II diabetes is characterized by a reduced receptor sensitivity to insulin.? True or false?,,,,0,0.658624291,0.281734467
2140582,How often can you donate blood plasma? ,,,,0,0.586227179,0.010620799
174454,where can i get i glucowatch? ,,,,0,0.396027774,0.1054129
757524,what is the best medicine for diabetic patient? ,,,,0,0.428459764,0.157016531
3323482,If u put sugar in someone car gas tank what will happen? ,,,,0,0.515544832,0.042349435
189808,what are the signs of diabetes? what are the signs of diabetes ???,,,,0,0.396274805,0.29037568
955923,High blood glucose stimulates exocytois of insulin by beta cells of the pancreas? A. TrueB. False,,,,0,0.668396115,0.301631153
396972,do any body like the lapband? i am thinking about it .,,,,0,0.543109119,0.408443987
1865177,quite insulin and take an other medicin? ,,,,0,0.536701858,0.2172115
3794763,Hoe to reverse diabetes without drugs? ,,,,0,0.549617887,0.209630072
949002,whether insulin can be orally administrated to diabetic people or not?why? ,,,,0,0.620667458,0.211725116
979276,Why does the pancreas continues to secrete insulin after a person stops eating? ,,,,0,0.678903341,0.257431924
3462316,Is it ok to drink the same night I donated blood earlyer in the day? ,,,,0,0.512633443,0.127551734
3697896,How much cinnamon can a diabetic have? ,,,,0,0.578294694,0.25548771
2589319,"Does exercise after dinner prevent Diabetes? Does exercise after eating help prevent diabetes? If so, how long after eating?",,,,0,0.557778418,0.107686766
3623743,"dr. says blood work normal? My blood work shows anemia and infection. Counts high here, low there... ???",,,,0,0.655045748,0.086226724
3771406,if diabetic has hesd congestion ans sinus blocksge whst can tjey tske for it? ,,,,0,0.672701716,0.247685596
3440177,Distinguish between hypothyroidism and hyperthyroidism? ,,,,0,0.487349629,0.298790872
3515814,"How to cope with hunger pangs? so basically if your on a diet, how do you cope with being hungry?",,,,0,0.550337553,0.269839346
3684732,Can diabetic patient take fruit pappaya? ,,,,0,0.544532299,0.222104609
3681511,What to eat to lower blood sugar? what to eat at meals,,,,0.0359336,0.564960003,0.318377912
937032,what is diabetes millitus? what is it  what are the signs,,,,0,0.593721986,0.27693519
485401,Describe the general physiological functions of endocrine glands? ,,,,0,0.668427944,0.184139207
927504,why do we eat every day? and not stop for atleast aweek?????? ,,,,0,0.522337675,0.319849372
2685363,what are the responsibilities of glucagon? ,,,,0,0.526875615,0.230404407
2555340,How much sugar level is required in human body after drinking glucose? ,,,,0,0.665089846,0.364006281
3423652,What is good for diabetic patient? ,,,,0.057844211,0.548056364,0.167693019
1628932,The link between obesity and diabetes? What's is the link between obesity and diabetes? I can't seem to find it??,,,,0.018727918,0.633103848,0.31163618
1456444,why is cake worse than frosting for a diabetic? ,,,,0,0.483524233,0.156461999
834564,What is the most important to know with the patient? ,,,,0.042680192,0.538384438,0.112165079
93366,what does hypothyroidism have to do with diabetes? ,,,,0,0.542846918,0.330422133
3779911,"If you cut sugar and starch from your diet, what would happen in a years time? ",,,,0,0.516936243,0.201478452
3079585,Does tucking in your shirt give you diabetes? ,,,,0,0.457923383,0.277622521
1814451,question to overweight/obese people? What are your thoughts on Michelle obama's let's move program?,,,,0.0190316,0.611827195,0.042301372
2589328,Why do my armpits sweat so munch? ,,,,0,0.529571891,0.267392248
1634142,is a jacuzzi harmful for a diabetic? ,,,,0,0.522529721,0.097332902
